,text
2364,"It doesn't ""pertain to the workforce"" because women's work isn't paid, and therefore is not considered work. But you know, shine on"
718," Ok, name the person who paid the SWATer. If your claim holds up, they'll be dealt with. #GamerGate"
6806," The few things Islam came up with were from conquered people and came in spite of Islam, not because of it."
2547,RT There is NOTHING more retarded then a female who talks shit about kicking a guys ass. I'm not sexist but get real bitch.
3901,RT Not sexist but women comedians suck
4813, I was referring to his more famous one but...love this. I understand the most I can do against feminism is raise awareness.
898," your bot certainly fooled me! I must admit, I was spanked this time."
2489,RT Call me sexist but I do not like girl refs for football.....
801, it's mechanical
2020, yes
2572,Seriously. Crazy-eyes is staying? #MKR
4363," No, idiot. They were completely exterminated on the majority of the Arabian Pennisula."
10844, You must be one of those nuts who thinks the crimes of Christianity justify the crimes of Islam.
4710,"Anyone else notice that all of Katie and Nikki's dishes were based on them being sluts? Sausage, cock and tarts? #MKR #MKR "
6530,"Well that's MKR done for the year. Seriously, does anyone watch past the instant restaurant rounds? #MKR"
1920, You have been completely defeated and you are just too dumb to know it.
6375," a figurative storm of shit - a shitstorm, if you will - that is now causing people to get harassed."
2370,Do yourself a favor and read this badass shit: 
700,Watching #MKR #MKR eating pork spare rib and quinoa cooked in pork fat with coleslaw #dinner... 
1684, They are sending a squadron to Jordan now. Baghdadi will pay at least Daesh for his little torch show. Stupid Kaliph.
6814,"#MKR No sauce for your Pork, Lloyd will be so upset, he loves a sauce with his pork"
738,I sure am hungry for some scrambled eggs.
2437,"Okay. Hey, tech industry contacts. I need to talk to someone from Salesforce, Atlassian, and uh. Yeah, that should be good for now."
2127,I feel sorry for the tent. #mkr #mkr
5525,Hanging out in the Dice lounge at #developerweek if anyone wants to stop by and say hi. 
1826,#MKR you'd think in her downtime Annie would have paid Napoleon Perdis a visit and learnt not to use the same coloured blush as your hair...
5042," She blocked me and I blocked her, why is that sexual abuse apologist in my TL?"
2006,"I just saw follow Friday's in a row, which really freaked me out because I have things that are due on Friday. Damn you guys."
4381,"I just noticed that Bey is wearing a Wonder Woman tshirt in her video, Blow."
10897, Glad to see both men and women supporting #WomenInTech at #GirlDevWeek #DevWeek #tech 
33, :)
520, Gotta love exchanges like these. #QuestionsForMen #WhatFeminismGaveMe 
4147,i actually hate the adelaide teams on #MKR this year ugh
2073,"RT I'm not sexist but I think in general, men make waaaay better music"
6781," Ugh, It was so much better when ""report as spam"" and ""block"" were IN A SINGLE MENU. Please recombine them. Paging "
559, I was *shocked* they didn't try to darken skin colors.
1436,"i can't even Call me sexist, but I actually prefer having guys in charge. Lol atmosphere is more laid-back &amp; fun. Women are serious"
1272,Not chefs shut up #MKR
3004,"Please women, stay single. Please women. When you commit to your man, commit to the gym as well. #nosexist #committokitchentoo"
1640,#mkr deconstructed by girls that have deconstructed brains ! Nearly brought up my dinner when I saw that crap on the plate
3993," ISIS is different from Max's friends, Hamas. ISIS throws gays off rooftops. Hamas beheads gays. "
2057, 
6582," Again, you talk like an idiot. I have no religion and what you say changes nothing about Muslims being extremists."
195," Oh look, another lying Putin paid internet propaganda bitch. "
4972," Read your own tweets, bigot."
2422,. Barb Sheehan NEVER says a word about being abused for years. Kills husband. Claims abuse w no proof. Walks. Fems cheer.
3681,"RT I'm not sexist, but when a woman presents a football show I just can't take her seriously."
1052,#mkr #mkrnz #Aotearoa #pasifika #Tatou 
569, Kurds rooted out ISIS from western Kobane | 
11257, I AM SO FUCKING EXCITED ARE YOU EXCITED
2045, Article is the same defensive stupidity and same failure to confront the real problem. This will assure that such attacks keep up
1699,"I've never met a sexist who can spell ""genuinely."" Call me sexist or whatever, but ive never actually met a genuinly funny girl"
2093, Another ad. Seriously? #mkr
2423, ISIS terrorists recently killed by YPG in Kobane countryside #TwitterKurds 
10801, Baghdadi ran like a chicken in Gwer.
3134, Again you are lying. The mass graves are being uncovered as the Kurds take back their land from the Daesh animals.
441," there is corruption, for sure. But it's all in AAA gaming, and their abuse of journalists."
572,Jeans were a bit tight tonight Andre ??? #mkr #mkr 
4051,got bad reviews from the judges was priceless #MKR
2731,LRT: It's fucking rich when women are delegated the lion's share of housework and then mocked for their prowess at it.
480,"#mkr,What Kat and Andre are doing,totally wrong should not be allowed,just so they get to stay,totally wrong"
4267," When religious war, jihad, is a cornerstone of the religion there is no possibility for reform."
169," And God said, ""Don't pay them a living wage for that shit because then they might leave men!"""
1638, So you think I have a right to murder anyone who offends me? Are you living in an asylum? Because if you aren't you should be.
5951, that would be *amazing*
1043," one question, thousands of answers "
1280, 'these people do not share your values' former archbishop of Mosul we project our enlighte...
2257,this is the same company that SU bragged about when wadhwa joined them. this lawsuit happened *years* before SU.
2547,"Let's talk about how #BillCosby deserves to go down asap, but where was the cascading media blitz on #WoodyAllen? Fucker is still a demigod"
5891," The lesson the world learned about Islam is that when we get rid of their brutal dictators, they are replaced by brutal Islamists"
5275, #MKR Kat and Andre get to stay? Seriously? This is so unfair. So not impressed with the strategic scoring. Karma WILL be...
6564,#asskickery hahahahaha #mkr #mkr #mkrsexylloyd
1926," purchased from sock dreams, sadly. :P"
853," #ISIS leaders order all fighters to vacate their bases and move all prisoners from #Raqqa, fearing coalition attacks after #K..."
4218,Are these two serious! #mkr
5375, AH
1351, Those Jews are assholes. Most Jews are secular and humanist. Most Muslims are Islamists. 
2799,"The missus loves #MKR if I have to watch five more minutes of these stuck up, idiotic, bit hookers I'll neck myself. #goingtobed"
5083, i love what they've done with trolls
1977," what company again? :P (sorry, it's a crazy... year?)"
2657,Those cheats that gave the girls a . Should be chucked off the show #MKR
2429," No, not going to bed with her is a seperate option. There is no ""mentally""."
3623, By showing your love of a genocidal animal like Baghdadi you have given the reason why Islam must be exterminated.
568, The threats are either serious or they aren't. I guess you don't view #GamerGate as emotional terrorism.
5665,Uh. A GamerGater doesn't like reboot. 
10285,"CA physically separates from US in a natural disaster. CA decides to separate as a governmental entity as well, proclaiming independence."
935,Just a few minutes until this panel starts. Zoe goes last. Making the announcement when she does. Teasers until then. :)
3387, LOL. ISIS targets civilians more than they do military. There are thousands of Yezidi mass graves.
152," Back then, Men were in charge and women were obligated to them. Today, women are just as equal and even better. Not sex..."
3496,What a surprise. mess on a plate #MKR
4754, You are too pussy to handle Kurdish girls. Western boots would turn you to worm meat.
2055,"Sauce, capsicum and stock from a packet / jar..The quality of cooking I expected. Double standards from the 'promo girls' #Mkr #MKR #MKR "
6097, Why Our President Chose to Insult Christianity and Excuse Militant Islam at the National Prayer Breakfast 
234,RT i'm sorry i'm not sexist.....but i do not find women comedians funny. maybe tanisha long
232, Now if Hollande and other leaders will only understand that the Islam of the Quran is radical Islam. Outlaw Islam!
5240," ""dens of apostates""? Murder for the sake of religion. Could you get any more stupid and inhuman?"
1001,THIS IS SO CRINGEWORTHY #MKR
2021, not giving the talk. just going to be there for the fireworks. :)
5034,You have a tail??? #MKR
10217,my hate for kat is getting stronger and stronger every time i watch her. #MKR
2189,RT Guys be better then women in everything !! Not sexist but it's just coz we are competitive as hell
1666,Mom's dog just woke himself up by farting. He has been crying for the past minutes and cannot be soothed. His butt has betrayed him.
1758,Muz's Kitchen Rules #MKR 
774," The first ""colonizers"" or ""crusaders"" were Muslims who attacked Europe years before the Christian crusades."
1084,"I'm actually not too sure if I can last through this episode if they keep breaking out into a song, dance and catwalk walk! #mkr"
16,What a riveting little lesson in walking the catwalk. Thanks ladies #MKR
2775, And here you are honoring terrorists that your master Putin sent to Ukraine to steal their land. You are filth.
504," I know hundreds of Christians, but not a single one that fits the discription."
3246, The lofty status of women in #Islam: Woman's testimony the weight of a man's. #WomensDay 
1272, We gonna get turnt for #MKR rest easy brosss gone but never forgotten #A MKR
1408," peshmerga surrounded by hundreds of daesh fought for hours untill they got rescued, unfortunally of them got ma..."
4418,Greece's problem has been too much government destroying the private sector. So they voted to make kill of what's left of their revenue base
573, RT from AFP. Translated from French. Here's who else has been murdered after running afoul of Vladimir Putin. 
1034,#MKR This is fast becoming like that crap 's movie- Neverending Story! More instant restaurants- Aaaaargh!
686,Should've gone for the sliced pony after all Annie. #mkr 
852," Jews are represented among Nobel prize winners by ratio of to over Muslims. Jews contribute positive, Muslims negative"
2076, Tonight's My Kitchen Rules elimination was complete bullshit. #mkr
290, Rape is a violent crime. 
1397," If you are impressed by madrassa rats, Baghdadi has his Phd in Islam. So who are you to tell him?"
1577, 
5055," . st videos when I searched ""Anita Sarkeesian"": * angry rants attacking/""exposing"" Anita. * FemF..."
4394,"Sucked in Kat, you mole #mkr #mkr "
1101, Why deny facts straight from the Palestinian horse's mouth? 
6628, Any attempt to stand ground in the open will make them easy picking for coalition air.
517, . This issue isn't about me any more. It is about ethics in journalism. How a public radio station slanders and then...
889,A hit with -year-olds Don't treat women like an object. It doesn't like it... #JK #NotSexist #SorryNotSorry
563,I dislike weather above F.
3110,HAH SUCK SHIT KAT &amp
834, Me either! #MKR
1269,Who's gay?!?! #mkr #newidea
2129,Joe is looking hopeful. #MKR
1773,Cat seems more like a dog with all this strategic voting #MKR
257,"Go ahead, sit on my purse strap and not get up when I say EXCUSE ME, it's not like I exist or take up space. #fuckmenonpublictransit"
10114," I'm not sexist or anything but wow, women can be totally cray cray at times haha"
127," Rosti in a sandwich press? Christ, the office kitchen's gonna be a mess tomorrow. #mkr"
2660," That kitchen looks like they've re-enacted ' Girls, Cup'. #MKR"
10809,Jesus how dumb can you get #mkr
5180,Weeeee. That's what I get for grumping/joking about a family member. Random internet rage. 
5306, Here is a good discussion of slavery. 
3335, oh no. So worried. Totes shaking. Why care?
394," DEMS, the party that kicked GOD to the curb, but DEFENDS ISLAM! "
561,Andre you fucking whipped cunt!! Arghhhhh #mkr #deathtokat
901, MUST WATCH Moving clip on Kurdish Pol. Prisoners executed under Rouhani's tenure in #iran 
5705,RT Call me sexist but I can't stand seeing girls neck a pint
2512,I think Kat has done a pretty good job of humiliating herself already #mkr
2161,I didn't think there were any of those people left...
2698, i've also got my phone docked next to my computer. It throws up a notification for DMs. I use the web interface on my PC to send.
785, positivity's cool but make sure you're not doing it on the backs of people who are still hurting &amp
2151, tweetdeck has gotten a LOT better! they finally fixed the big blocklist bugs.
4785, I'll throw a vote your way once I get to a computer
2079,"Katie &amp; Nikki's next job will be playing ""people who stuff up simple tasks"" on Infomercials #MKR"
2485," haha, welllllll, i'm usually here so you know, whenever you're in town, hit me up. :) i miss you!"
32,Think these two girls have wayyy to many tickets kn themselves #MKR #PromoGirls #promogirls i think not
6525," I object to any food item that rhymes with ""turd"" #MKR"
856, You are too stupid to talk to. Blocked.
3247, Raise your hand if you have ever felt personally victimized by #TheDress 
5610,"No one said threats weren't serious. However, there's a difference between ISIS and GamerGate. "
1552,. we LOVE the idea of a #campingchallenge #GreatAussieBBQ #katandandre are going down #MKR
2827, hah! We have to secure funding first.
2673," ""We're off to a special location for this announcement. It's a warehouse with drapes and a stage. It screams 'special'."" #M..."
1917, To get the skin really crispy you have to burn it alive in front of its family. #mkr
1130," But it is a lie. The religion is a disgusting, terrorist, hate mongering piece of filth. That has nothing to do with individuals."
3649, 
5627,Might be time to make a Facebook version of #ggautoblocker :P
58," When I ask them that verbatim question, they call me an abusive misogynist. You? Do you ever actually get an answer?"
4324," Oh, please don't give me a link to Harun Yahya's silliness. I've already seen it."
2188, I'm guessing they are just used to tuning out complaints.
5404, Tell me how old you are. I don't want to be here attacking a child about her religion.
1835, There is no one more apartheid than Muslims.
4626,"If you don't like doing nice things for your female significant other and find it a chore to do once a year, you probably don't love them."
905,Happiest doggie ever. 
556, This is the kind of catwalk you see in Penrith or Parramatta Westfield! #MKR
5484, You literally just said women should not be paid the same for doing the same job.
1024,#MKR how many rounds do we have to watch until we get to the real competition?!
4152," Also, I just found out about this: What in Andraste's name is this nonsense?"
498,Wooooo Hoooo!!!! My gals Ash and Camilla win!!!! #MKR
5244,Giving the loser teams enough time to cook everything well &amp
1175,"When is the next darkmoon faire? I am so, so close to being grandma the insane."
333,In other news: the team I was rooting for last year just favourited my tweet. I'm not crying... you are. #mkr #AnnieAndJason
1983," I m not sexist, but having a female as the head of the Secret Service is the one thing I believe is err. Men's reflexe..."
1362,Leave it to GG to think women need to compete for the attention of men. Haven't you listened to Bey's flawless? GAWD 
1984," look dude, i want to be nice to you, but FUCK OFF. you got harassed by a spam bot. leave me alone."
10900,Were gonna get stuck with this friggin head #Kat #MKR 
5697," And FYI ""Can u"" is asking YOU."
967,Bottom teams. I'm thinking Kat and Andre and Annie and Lloyd #mkr
6415, I think you are pretty stupid.Girls are not even adults when they are . At they are children playing with dolls
10506,"""Proven how well we can really do"" Uhhh, what? #MKR"
10286,I can't even watch my kitchen rules without cringing at these girls #MKR
1156, Can you just kick Kat out for being a strategic arsehole? #mkr
10691,I'm looking for a few people to help with twitter. Log &amp
2931, And from me. But then I compare him to the people trying to exterminate him. 
4305, 
394,Banished is way too addictive. Where did my night go?
10484,#mkr view here 
1921, #BanTheBurka 
647, Yahya flips out about PKK being communists. But that is clearly no longer true. Just propaganda. 
1040,"Nothing has, or ever will, 'hinge cous cous.' #mkr"
869," Yazidi children who are taken from their parents, forcibly converted to Islam! #Sinjar #Shengal "
1608, Stoning women to death have become common in Mosul by the Islamic State. photos published today 
1088," Hours away, probably fucking some dude instead of making me a sandwich."
4027,"Stop calling it ""being strategic"" when really it is ""being shameless dirtbags"" #mkr"
5047,Fuck cat u are even uglier when u smile u bbbbitch #mkr
1017, scrubbing bubbles works amazingly well
2976," Furthermore, you cannot identify a single verse of the Quran that limits the age of marriage of a girl."
1397,Fiddle dee dee potaters #mkr
3221, The Saudis were the Mujahedeen before there was any involvement of the US.
1518,What's a decent RoR on (k)s? I've averaged . % over the past few years. Not sure if that's decent or not.
1100,Fml 
3574,""" Let's go """
723,While we're on the topic 
2219, And this sums up Islam. 
762,"So I don't think about it. Instead, I use it as fuel. I'd rather try to fix this so others don't have to go through this, too."
4020, I'm going to continue looking for the other papers to see if they help his case or show it to be politically motivated.
11,"If you're interested in working on solutions, we'd love to have your help. However, I can spot a flail for media attention from a mile away."
178," That's what I thought at first...haven't read comics in a while, so...I have no reference. Awesome job if fake."
575, I hope Kat gets Ebola and then hit by a train followed by a smack in the ugly face with a shovel #mkr #katandandre #mkrkat
11022, I mean if I can't rank oppressions how am I going to know who I shouldn't bother feeling sorry for?
149," yeah, i made a *bunch* of changes with the old ver, nice to see some of them aren't needed anymore. :)"
6395,Can't ask campers to wait for breakfast. Gotta give them what they want and now! #mkr
688,"RT I'm not sexist. But I dont like dealing with women, when there is business to do. They are too emotional"
1610,"Kat, karma is going to kick you in the arse. #MKR #poorsportsmanship"
1749, Islam is the cancer of the earth. It looks like this. 
2189,"""Seeing as you two think this is a modelling competition and not a cooking competition, I give you two a score of - for your looks."" #MKR"
1261, Shame on Zuckerberg.
710, They want to close ALL women's prisons.
10384,I REALLY HOPE THESE GIRLS DO A GOOD DESERT!!! #mkr
639,How have I never heard of ball culture? This sounds amazing.
336, Obama is clueless by 
1687,Forgot how annoying annie is. This is what happens when the series goes for ten years #mkr
1002, I didn't know you could throw interceptions and make tackles in the kitchen.
1035," Pirro Ligorio's map of Ancient Rome, which took him almost years after locating ancient sites &amp; monuments "
1670,"Today, I am happy to announce the Online Abuse Prevention Initiative, created with &amp; "
184, You are a filthy liar. Slavery is explicitly approved in Islam and raping slave girls is explicitly approved.
904,How's this for sassy? From #voguecafe But if I hear that word again I'll throw a shoe at the tv #mkr 
618,RT In women had no rights. In women fought for rights. In women were always right. It's a new year. #notsexist
1456,Can't cope. #MKR
10975,Gizmo can't believe Andre and Meth-Face are going through #MKR 
10514,SIIIIGH 
6224," I have no misogynist views. Feminism is an ideology, not a gender. FYI."
2409, i'm not sexist but there's something so off putting about girls liking the football #controversial
196, Why not complete the job at Baiji and Ramadi and Hit and Tikrit and let the Kurds clean up the North?
6180,That's bullshit Colin and you know it. #mkr
5100, Are we going to continue seeing the oppression of women or are we going to make a stand? #BanTheBurka 
4463,Can we just take a moment and reflect on everything that is wrong with this paragraph by wadhwa? 
5301, Colin..SHAMPOO YR HAIRRRRR #MKR
3587,Perhaps you could have turned the black side down on the pancakes? #MKR
605,"I have no intent on linking to the articles where he stated he was backing out. They were an attempt to save face, not an apology."
1264, THANK YOU RANDOM INTERNET PERSON FOR INSERTING YOURSELF WHEN I SAID NO PILE-ONS.
1862, How so?
462,I've never seen the low trac light before. It's been on for over an hour. Fuck this weather.
1383," Because I made sure I wasn't alone, and had multiple witnesses, before firing a male colleague. #YesAllWomen"
1645,"Things are coming together. If all goes well with my next meetings, I'll have a major announcement to make during GDC."
558,Ok so I'm not the biggest fan of The Blondes but.... Even I didn't want them to go #MKR
439," Aw, how awful that they got rid of humanitarians like Hussain and Gaddafi. I feel your pain."
1201,"If someone is too drunk to drive, they're too drunk to consent. If someone is trying to get your friend alone, protest. LOUD."
860,RT Women are reckless drivers. #Notsexist #realtalk
748," They won't mind if it's not perfectly presented. Really girls? Really? #MKR says the girls who are ""All about pretty!"""
3093," I'm an atheist, but God bless hot women who embrace/enjoy their own sexuality..."
11147, He simply repeats what is in the Quran and Hadiths.
164," The peaceful Q verses are pre Medina, Mecca verses when Mohammed had little power and was endangered."
2943," Good, it's about time they recieve what they have been dishing out for centuries."
1796," Islam only talked about the freeing of slaves who were Muslims.Since Mohammed was a slave owner,it continued to today. Good night"
3750,This is followed not-so-closely by with ( OC/ RT) GG hashtagged tweets mentioning her. Better luck next time.
1064,They didn't roast their own capsicum. Disappointed #MKR
3255,So glad the instant restaurants are over and done with! I've missed this chaos #mkr #ilovebreakfast #andcamping
682,"Wait, did they make the biscuit that they crumbled?? Or did it come from a packet?! #mkr"
2151, i miss sysinstall. :(
568, a million times this.
2105,#katieandnikki stop calling yourselves pretty and hot..you're not and saying it a million times doesn't make you either...STFU #MKR
10519," But the Quran says that verses can be abrogated, right? Now let's get to compulsion later. What does : say?"
2041, Do you suggest they drive out ISIS by shelling them with cotton candy.
11261,Kat complaining about strategic scoring..You reap what you sow. Oh and getting owned by Manu was a bonus. Cook good food problem solved #MKR
2784, you are changing your mind now? You've been saying I called you stupid. Still waiting for sauce.
391, She can abort. Adopt it out. Safe haven.
2959, 
3072, #Daesh destroys another church in #Mosul #IRAQ. #IS #IslamicState #ISIL 
5867, sometimes. :P i try.
10559,Another. Fricking. Instant. Restaurant. Round. #mkr
298,"""Only the best will enter Kitchen Head Quarters. And Pete's the best at speaking in phrases punctuated by weird pauses."" #MKR"
714," I love perl, but I think I'm starting to shift towards ruby. gem is nice. docs are horrid. need to read more about classes."
4024,I fucking wish I was a rattlesnake 
4031,"OH SHIT HE WAS THE ONE You can call me sexist if you want, but if you can't cook you become less attractive."
2521,""" What do u think her punishment should be? #QuestionsForFeminists"" #QuestionsForMen #QuestionsForWomen"
1808,Katie and Nikki may not be going home but / still isn't that impressive. I wouldn't be happy about that score you smart ass bitch. #mkr
461,"Really, really, really want to go to Blizzcon, but not sure how I'm going to afford it this year.:("
2599,Hey Kat and Andre .... you served soggy bread ... SUCKKKKERS! ROFL #mkr
6414, I know you have religious police telling how to dress.
3725," Reminds me of Simpsons where grandpa was screaming ""Death!!!"" at everything. Now it's rape. "
2219, Sweden and the EU...
177, Who is to blame for that?
969, happy to help. :)
5629, D: php D:
2265," not publicly, and only to him. that's not an insult. he's the one that referenced it near the top of his blog post."
4320,Annie and Lloyd wonder why no one is lining up.. Who the eff eats meatballs for breakfast.. #mkr
1824," I'm saying you can never ""control"" two different individuals to be the same."
848," Each day County Prosecutor Bob McCulloch delays indicting #DarrenWilson, he is endangering citizens and delaying the reb..."
1860,RT Chicks just aren't that funny....call me sexist
724,Geez how many family members of Vicky &amp
2788," Wrong, microbrain, she was , and you, like your prophet, are a liar. Here is the proof "
4209,Now I'm hungry for those blueberry hotcakes OMG gimme gimme #mkr
16, Another one of those filthy lies Muslims love to tell. This is the truth. 
3777,"O m g. taking the piss with these two, surely #MKR"
6228," this is awesome, and I love this."
961, i'm headed south and I'm about miles from the border. I'll let you know.
5678, And of course Christians all over the world are oppressed daily by Muslim bigotry.
6661," A single brotherhood, from the same idiot that just said, ""We are Muslim, we are not Shia""."
94," It creates the isolation needed for longer-term campaigns ( s of threatening, abusive, harassing messages per hour) to have ..."
