,text
340, Buddha forbid slavery years before Mohammed. Jesus had no slaves years before Mohammed. But Mohammed was forced to have?
1230," Can't get any more freaky than having sex slaves, beating women, making women slaves."
1077,#MKR can't wait to have Robert &amp
3455," a lot of people contribute just a little bit, and it turns into enough to keep me afloat. every dollar is immensely appreciated."
2708, Talk to me about being dumb when you figure out how to get working toilets into the Pakistani public schools.
1634,Kat on #mkr is such a horrible person.. I wish Kat and Andre would just get eliminated already.
800," automated programs, whatever. it's not clearly written."
4603," sitting here and spreading unsubstantiated rumors is a shit move, though. We aren't gaters."
1616, A ? This bloke is utterly demented. #MKR
3369, no more discrimination against L blocks!
2973,Pickaxe is the new crowbar. 
4696, DEAR STATE DEPARTMENT: WHERE IS HILLARY CLINTONS OF- FORM #HillaryEmail #tcot #PJNET 
10842, Because the Muslims have been exterminating Jews for years. And Mohammed started he Muslim hatred of Jews.
4994,#katandandre #absolutetwats #mkr #mkr why would you be such dicks!
204," #MKR To stop this strategic voting, perhaps announce all the scoring for each group of instant restaurants when they go..."
1979, can be verified from countless sources.
2364, I think the pink has gone to the girls head #imbeautiful #MKR
2502," Ukr Army got non lethal aid, scumbag. Putin sent tanks."
1483," Come on morons, let's all go to the same verses in our own Quran. Start with : . Are you afraid?"
1851, The later verses abrogated the earlier verses and what remains is violent and imperialist.
5101, hahaha
1951, Another Muslim blowhard. The average GDP in Saudi is less than the US. And women r slaves
623,What a CROCK !! for dessert ? You're kidding ? #MKR Better be a good surprise !!
11190,#mkr
2754,How gross that the blondes kissed the table EVERYWHERE! hygiene anyone? #MKR #MKR 
1486, Sad to hear that Thor is going to be a lady. Why the change? There is history here (real historic Viking god). #notsex...
1876, PatriarchyTM will expel me if I divulge that I have a note saved &amp
436,Discussion of the lemon Kurd adding nuance to the Middle East debate on #MKR
1537,Yumm Mushrooms. The Bacon of Vegetables. #MKR #MKR
120,"So now he targets women, because you know, they can fight back a lot less. lolllll."
626,why is their whole menu dick related?!?!?! #MKR
5305,Bless I totally forgot about the party favourite Shaz... #MKR
6570,WTF is Manu saying. Can't understand him. #MKR
10250, 
2615," Why do you think your prophet called blacks ""rasin heads""?"
6327, sorry about that. &gt
826, Awesome.
1467,"Jesus Kat, shut the fuck up and let it go :/ your a fucking tool #MKR"
1382, I'm looking for them...lot of hay on top of those needles.
580,"Got a mention on Tech News Night on Not % accurate, but close enough. : in. "
2107,"I have never felt more supported and safe than I do around the FreeBSD developer community. They are amazing, and I love them."
11236,"Someday, I'm going to drink &amp; start submitting pull requests to various FOSS projects' Makefiles to play fitting theme music during a build."
3590,Let me make this perfectly fucking clear. Every female major target of GamerGate is seeing a fuckton more mentions tonight. #LawAndOrderSVU
6258," Sucked in Kat, you mole #mkr #mkr "
217, 
1279,"Yesterday, wadhwa showed us all how *deeply* sexist he is. It's there for anyone to hear, in his own words. Hopefully the word spreads."
4444,"#MKR Those sausages look unlikable, do they even know what they are doing?!"
4102, Would you really be surprised? #gamergate #SVU 
2674,RT Do women announcers annoy anyone but me? #NBA #notsexist
199," Google ""Kate Millett sister NOW"" and enjoy. Long read."
2235, pretty sure they're Channel stooges designed to get the twitterverse fired up. Seems to be working #mkr
1076, Opinions are opinions. Far more Jews live in western nations than where they originated.
1820,Can't sleep and came across this #mkr #mykitchenrules #thegoblin #mkr 
3296, Is it possible to ask a more stupid question? 
601,"But marge, I'm missing the chili cook off! #MKR "
6989," No, that was just your pedophile prophet making excuses to slaughter them and steal their land and property."
242,Of course the dipshits stay #MKR
3082, #MKR What a ridiculous load of tripe. Keeping these girls in for ratings purposes only.
1957,"Don't put on the cape unless you're prepared to be the hero. Sorry, dude. You're not the hero. You're the villain."
1422,Irony is dead We all get bored of women. They stop making sense after sometime. Especially the talking part. #NotSexist
1215,Kim Kardashian has had marriages that didn't stretch as long as #MKR
2605," Why are women so mad at Wadhwa? Maybe instead of calling them crazy and dramatic, you ask them. #stopwadhwa "
2387," I'm not sexist, but I hate female sports talk hosts"
1859,Kat has an amazing future after #mkr I think a role as wicked step mother..... She just needs to age a bit
1343,#mkr leaving lip prints all over the table. Nice unsanitary way to start things.... Yuck. Why not spit on the plates too?
1565," No, the Muslim states are the most murderous terrorist states on earth. It's not even close."
479,Which will end first: #mkr or Tony Abbott as PM?
5164,"#mkr omg the kiss stains on the ""dirty"" mirror is sooo tacky!! Oh my god"
2223,"Also leave the eliminated contestants weight out of it, what did they ever do to you, how does their weight affect your life? #mkr #MKR "
2229, Kirkuk is the new Kobane from USAF point of view: a lot of targets in contact with friendly forces servin...
193, [ ] were struck by an airstrike. Local sources claims that about ISIS terrorist were killed #Mosul #Iraq
10840, Let's have a protest march against Hamas. 
3904, Norman Finkelstein not self hating enough for : Past his sell by date. 
5855," The problem is that they are forced to wear it, microbrain. "
4610, Oh come ON! They're not even trying to hide their hypocrisy anymore!
1924," After the #BorisNemtsov murder, I'm at patience for special snowflakes who bleat about feeling ""unsafe"" b/c someone sai..."
425," there's too many people with common sense, sorry. We don't need to rely on feminism to bring about e..."
315,Why must Kat be so mean. #MKR #mkr 
5894,"Almost crying. But not quite. I HAVE SOMETHING IN MY EYE, OKAY?"
1472, You should probably have your hearing checked. If higher frequencies have excessive volume to you you may have hearing loss.
3218,Omg that dessert is so deconstructed lol it looks so easy! #MKR
1613,Im really disappointed that none of the campers threw their full shit buckets over #CuntAndAndre #KatAndAndre #MKR #ShitBags #CantCook
2587, if the vapid duo of conceit get through tonight I'm not watching again #suicideblondes #mkr
2248, And you are supporting the little head choppers and honor killers in Palestine.
11267," So, the hostile help line said hostel?"
10565, Why not? The Palestinians behead gays and honor kill women.
2110, And no I'm not sexist. Women are to be treated as any other person on this planet.
314,"Every day I'm reminded that the most dangerous men are not the ""lol women can't drive"" crew, but the ""I'm not sexist, but"" DERAILMENT crowd."
253," oh. yeah, it's his seconds of fame. he's still hurting after a bunch of senior tech people ripped his ""work"" apart."
2520,The Greeks gonna serve up raw eggs? #MKR
5880," Hey troll, you're a piece of shit. How's that for a compliment?"
773, i am. because i've verified my numbers when i was monitoring more than this. ^.^
5317, Stupid article devoid of facts or reason.
995,Kat and andre make me sick they don't deserve to be there. #mkr
2658,. Not doubting. Think feminist hypocrisy on Ladies Nights is a great example of their hypocrisy. Putting it out there
1109,Mr StephUpperLip hates Kat even more than I do. He even calls her Katty Litter. #mkr
311,"Yes, you put in the wrong way. Cue dumb blonde jokes. #MKR"
2354,"These delusional, narcissistic hostesses on #MKR make me want to vomit my own dinner up."
5387," Yes, that is the verse that insults Jews. Thanks for cherry picking."
678," I honestly can't believe they added female Soldiers to Call Of Duty Ghosts, I'm not sexist but it's kinda weird and a l..."
2611, You can't get any sicker than the Muslim animals following the instructions of their pedophile prophet. 
5906," this is the same dude that thinks that not being allowed to publish an article to a site he doesn't own is ""silencing"""
10971,RT I'm not sexist for my opinion on women drivers.. I've just experienced it plenty of times.
10803,I guess that's one way to get around the user token count limitation per app ID.
1704," Katie and Nikki, smug, vacuous, condescending, putrid, self congratulatory and bland. There. #MKR"
1512,I've seen soup kitchens that provide a higher quality of food. Seriously. #MKR #MKR 
5833,"Hey, that party at GDC right after promoting # RTB? Not cool. "
6125,Lynn and Tony can go back to what they do best.... Sitting in the McDonald's drive thru #mkr
5924, nope.
3666,"Kat and Andre don't deserve to stay in the competition. It's about good cooking, not """"strategic"""" voting. #mkr #outwiththecheats"
1799," NO, it isn't....its about obnoxious Liberal women being able to spout garbage they say repr..."
2644,"""We're about to turn the heat right up! WITH ANOTHER INSTANT RESTARAUNT ROUND!"" *Australia turns off their TV's* #MKR"
1174,I would say Josh take your top off...but I feel like we'd be underwhelmed #mkr #wherearethehotmen
766," Fortunately, we've got controls on Twitter like block and mute, which keep us from seeing *most* things we don't like."
2139, :P hopefully you didn't get spammed with notifications.
1614, A self appointed vigilante for feminism yet shares an article that proclaims men aren't needed. You dont unde...
135," A religion who has a murdering, hating pedophile at it's core has no room to be reformed."
1892," Feminists call anyone who disagrees an MRA cause they desperately need to think that only MRAs oppose them, rather than near..."
81," Considering what those ""local Arabs"" did to Kurds, Christians, Assyrians, Ezidiz, etc., who cares."
1689,"RT I'm not sexist, but I believe in my kids having parent home. Being fully parented."
1141,". Yep, pathetic. Let's examine idea anti fems just hate women. Do misogynists fight for their ""right"" to hate? Or just hate?"
3905,"RT I'm not sexist, but I really cannot stand women sportscasters. #sorry"
310, boys no girls killed isn't violence against boys of killed by Eliot Rodger = girls and is vio...
2078, I once again want to express my gratitude towards my ancestors for not converting to Islam. I would have no place to hide in...
5205,RT Girls should shave no matter what month it is
5945,Don't like liver #mkr #mkr 
1834,"I'm going to lug my macbook air, my ipad, my DS, and my surface pro with me. I need my battle station. This will suffice."
3320, Why should I. The Hadiths numbers and verse numbers are given. Look them up.
3916, Filthy Islam created them and is funding them.
2032, i hate cats
251, Screw feminism &amp
1325," I swear, I'm not sexist, but I honestly just cannot stand the woman college football announcer on ESPN "
1058, Thank you for that dose of #OddlySpecificMisogyny
10501,Annies back! #MKR
10892, Go to wiki are read about the Wahabbis. Read about the Wahabbi attack on Karbalah. Read about the Ikwan.
1852," Again, the woman must be obedient to the man, even if he is a fool and she is brilliant. You are proving my point again."
10824,I reached out to with concerns the day the article was published. No response. Nina cares more about page views than problems.
1796,the afghan bowlers serve up better shit than this garbage on #MKR #notevengoodsorts
10480," it's what i'm *trying* to do, at least targeting specific groups/causes. it's tricky. have to look more at statistics than words."
1543,"Umm, wheres Manu? #mkr"
497,Gay fiance is not going to cope being away from the fresh meat #MKR
2638, My god. You can't use a can opener? Reminds me of a joke I know. How do you know a blonde.....? #MKR
756, block while waiting indefinitely on data from a filehandle.
10468,"Yeah, child labor IS illegal. Unless you mean ""women""? Girls should not be allowed to be commentators for football games"
581, Why should the world care when Islam declared war on all humanity years ago.
1071,GET. FUCKING. FUCKED. #mkr
1904, I think so :(
329, The deconstructed lemon tart looks pretty much like what your plate might look like after you've EATEN a lemon tart. #MKR
311," Hmmm...that's a good point. Bathing in male tears is more of a feminist thing, huh?"
3873,Wait. Twitter handles video now. What's the recording length limitation?
2517, On Yemen's last Jews: 
10945,Drasko in #MKR looks unnervingly like crazy Clay from TV show #Banshee
2871,#mkr NOOOOO!!! I wanted Kat and Andre to lose!!!
753, Daily Civilians death toll in Ukraine clashes is times more than Middle East death toll at the moment v #twitte...
1834,RT I fucking hate rich ass snobby women that don't know there place in front of men! #notsexist #justventing
3293,#cankles #methteeth #mkr
6720,"No puppy today. This puppy had some pretty severe anxiety issues. I can work with that, but leo would not be happy."
88,People getting all mad at Racists Getting Fired is my favorite mouse squeak of white supremacy
1158, until it happened to us. Not cool.
5299,"Actually u need help Call me sexist but I actually have nightmares about Nancy Pelosi, Hillary Clinton, and Elizabeth Warren."
1083,"What's going on is you're sexist This is not sexist, but I know about funny girl, what's going on"
6373,You have a face like a dropped pie lol #MKR
817,These girls are either hand or feet models #MKR
2297," This is not about war between countries. This is about Muslims starting wars with ""unbelievers"". "
1581, gamergate do u even github 
11164,"If the judges didn't give their critique first, the other contestants wouldn't know what to say; they're just copying the judges #MKR"
2567, has shown me most of them...thanks. 
3883,"RT I'm not sexist, but sometimes women proper need to stfu "
2393,Why has #MKR really done downhill? It's not the same anymore....
10472, LLAP. :)
6715, Because what you think is Islam has no resemblance to the real Islam.
3976,"Celine does a good elephant, she's obviously had practice #mkr"
3336, The fact that Jimmy Buffett ever sold a record is an indictment against the idea of American exceptionalism
1164, will take a look.
5229, Nothing has any value for Arabs except the destruction of the Jews. And the Arabs must pay Palestine to destroy em
5889, Egypt threatens military strikes on Yemen Houthis (Iran-backed) if they threaten strategic Bab Al-Manab shipping lane htt...
1761, I can prove that my code is in FreeBSD. And there are articles that state that FreeBSD is running on the PS and PS .
2881, we've got a PR firm. I might toss this their way.
10718," Oh, you're humiliated Kat? We've been embarrassed for you ever since this show started #mkr #MKR "
1555,"C'mon Annie and Loyd you can do it!!!! #mkr hey Dad, Mom, and Lisa"
1295," Next step, learning to ride a bicycle, and then learning to ride a camel."
1311,Why are the WA contestants always assholes? yeas running!! #mkr
1544," Actually, they did. Feminist cannibalism. It was great."
4052,And the best mates from QLD...ugh #MKR
6463," I love these tweets because you can whine all you want, you will never be a sportscaster, and women are! MWUAHAHAHAHA"
3050, just saw your tweet on #mkr!! These bimbos should go!
2155,"#MKR yes, bacon for breakfast, what a terrible idea"
2766, chef wankers #MKR
3182,RT Im not sexist but i can say with certainty i havent had an intelligent conversation with a female under .
1062, Everyone underestimated us. They didnt expect us to only be mediocre #MKR
1512,. Agreed. I just hate that society is so economically illiterate they blame sexism rather than capitalism for those questions.
2468,I hope to god Kat cant sleep at night #MKR
6148," Honestly, I want to meet the bands of guerrilla feminists holding writers at gunpoint until they create a token ""strong female"""
10326,Ash and Carmilla are dilly dallying much #mkr
10703," Yes, Islam respects women. "
184, Have you noticed how ISIS prices women in the slave market?
11283,"I just watched #LawAndOrderSVU. It was... distressing. Corny early in the ep, but then... jesus."
2534,I AM ETERNALLY ANGRY. #MKR
5278,This video and this song is just.... yes. 
4008,"What I took from all of this is that doesn't bother researching anyone - just assumes if they disagree w/him, they are misinformed."
5297," ""Oh, you're mad that I called you a [gendered slur]? See! Women are so unreasonable!"" Yep, that's totally why women experi..."
766, And the reason that he is popular with them is for fighting against the soviet invaders.
861, it looks like somebody made this pointless account to get thrills out of telling complete strangers the...
10352,Insert evil laugh here #yousuck #MKR
2488,"It's a unique challenge to uphold feminist ideals in a heated argument in your second language, against three men"
1400, there was one where there's like this dude... he's big... and the hands out of the ground?
2690,Look mum.. Left right left right.. I'm a model.. No sweetie you're a promo girl... Here's your bikini go sell some shots! #MKR
5660, And I doubt that you would find those Serbs in a church. But all the ISIS go to Mosque per day.
3469," Twitter, email, Evernote, web. Hearthstone."
11110, Problem with vile Muslims is that they try to rationalize &amp
1053,#mkr here comes a roasting!!!!!!!
3572," my comment was sexist, but I'm not personally, always a sexist."
6018,"annie, say hi to karma. #mkr"
2371,Talk the talk but can't walk the walk #MKR
2671,Time to cheer on twinners on #mkr! Learn more about them here: 
4622,Turn up your hearing aid? A thought I'm not sexist but it's nearly impossible to listen to a girl talking about football on ESPN
589, Good idea ??? Yes /No ? 
2335,Cracking up that #cuntandandre is trending! Lmao! #loveit #MKR
2081,Who cares abt coffee with so much yummy food ! #mkr
4769,OMG I have a feeling Im going to be overwhelmed by my emoticons in tomorrows #mkr 
350, Jews used to live on % of the Arabian Penninsula. Muslims have virtually exterminated them.
1920," Do reality check. Ask why people don't hate Buddhism,Hinduism,Tao like they hate Islam"
11173,"Oh, look. Here's nero and wadhwa colluding, to borrow a term from the GG playbook. #stopwadhwa "
2769,"And when they're all PMSing at the same time LOL I'm not sexist, but I can't work with female managers at the same time anymore"
5078," I'm not sexist, but why do feminists complain about everything?? If there was a cure for cancer I think they would moan! Giv..."
783,". ..mistake. I find both abortion &amp; child abandonment detestable. But, if one gets an awful choice, both must"
383,Imma need some time to get over Kat &amp
2191," Like a bunch of mindless bots, Muslims repeat the same lies in exactly the same words, every day, multiple times a day."
3020, also are you for real hey twitter there are real nazis on here get that shit outta here thxbai
9978," Basically, u could use a woman #NotSexist RT I need to buy soap &amp; return these red box movies. shit need to ..."
1931,OMG WILL LMAOOO. He cracks me up #MKR #MKR
1739," And what are the Muslim scholars going to do?Say,""You caught us, our religion is violent and barbaric"""
490," Go look up Russian news media on wiki, troll."
2580," Today the Hamas terrorists still call ""Khybar Khybar"" to the Jews when fighting them."
2863," Oh. My. God. Seriously, pure evil. That is not editing, it's just plain nasty to make those comments. #MKR #KatandAndre"
1592," Oh, you mean like Competitive Lipstick Application? Olympic Shopping? The World Series of Eyelash Batting?"
2614, If you want t plumb the depth of Hamas virulent racism just read the Quran where it is spelled out in black &amp
896,#mkr #mkr I dislike kat and andre so much i even got kat's name wrong. 
2153,Aaand the owners just walked in to claim the puppy. The police are not happy.
2426, 
579, i really wish I had the time to dig more into SU - financials and such. Seems basically CxO circlejerk.
2271,What could you have possibly modeled #mkr
10766,OMG SHUT UP DRASKO AND BIANCA #MKR #FINALFIVE
1005," you are helpful, valuable, and appreciated. your voice helps. we all appreciate you. you should know this."
4238,#mkr Perhaps if the girls had spent less time looking in &amp
10822, Bring us some pancakes at anytime of the day! #love #mkr
1999, #Muslim #ISIS Apparently Questioning #Islam is not welcome in the Middle East. 
4436," Wow that undocumented, confirmation bias-stinking comment sure convinces no one!"
673,"We're being punked, right? They've actually never been in a kitchen before except to microwave their Veet. #MKR #KillerBlondes"
6424, Im not sexist but most women today will take up all the best seat in the pubs/clubs when they have no clue what's going on #...
783," Sooner or later, liberal Europe must fight back "
2014, Islam is a religion with zero spiritual content. But it tells you exactly how to wipe your ass.
586,"I feel weird putting up quick little posts like that. Like it's lazy, and bad. But I think it's a conversation that needs to be had."
6789," uh. I have always rescued dogs, usually grownups. Leo is nearly , adjusts better to younger dogs. But Ty for lecture."
10908, SAVE SOME RIBBONS FOR ME. &lt
288, I meant to highlight that activities in which women perform well are not deemed worthy because it is women that do them...
10546,#mkr Vida here 
814, While the Palestinian terrorists that Blumenthal loves are throwing their opponents off rooftops and really beheading gays.
2575, dark sky
3520,#MKR Kat and Andre get to stay? Seriously? This is so unfair. So not impressed with the strategic scoring. Karma WILL be a b*tch
4093," Nope, I know people who read Arabic and I have four different translations. You are lying."
4016," ah, okay."
1433,"RT xbox's were designed for boys and make up was designed for girls, get the idea #notsexist #promise #lol"
4828, Gov frames it as a 'pay' gap yet knows its simply an 'earning' gap. A distraction from real economi...
148, Hats off to girls who light their own weed. I don't understand why most girls can't handle the simple mechanics of a ligh...
4960, New life mantra 
3467,"I believe the correct term is bortches I'm not sexist , but some girls are just straight birches honestly"
1378,My #MKR take: Nikki and Katie should be the poster children for the obliviously mediocre 
1624,". None. I was going to go w/ ""toxic femininity"" or something if they answered but # ShadesIsAbuse has great plate discipline."
1166," Again, your entire concept of god corresponds to a tyrannical earthly egomaniac because you are simple and stupid. #Islam"
5662,Have a feeling the girls will stay. Just. #MKR
11105,#mkr view here 
10186," % of RN's are males, % of CRNA's. There is your nurse ""pay gap"" right there.(Well most..."
68, The stupidity of the leftists is to try to force us to tolerate the intolerant.
458,"RT Women vocalists in rocks music... thoughts? Me personally prefer men singers, seem to have more passion #NotSexist"
272," How NPR helped create the current panic over a phantom campus ""rape culture."" "
685,"RT I'm not sexist. But damn. You want equality? Learn to not pull the ""I'm a woman"" card."
5417, you can only have one GV # per acct at any given time.
6801,Really a can opener ? #MKR lol 
771,Lousy scoring Colin. It wasn't a mascapone sorbet dish it was lemon tart. #MKR
2783," ...whereas, prostitution is the same job for same audience* (for most part) AKA making one guy cum."
1454," Im not sexist, but women just can't drive"
1389," The important part is that they regrouped, rearmed, and immediately came back."
1969,I'm sure opening the bbq to let all the hot air out will make it cook faster. #mkr
5543," A genuinely interesting question...of course, the answer is predictable and boring."
659, noted. I'll put it on the list of accounts to kick further up the chain.
10261, How Blizzard is taking aim at toxic players in Heroes of the Storm: 
2384,RT on my way to vote for SRC.. call me sexist but I aint voting for no Lady..
2621, #ISIS #Islam PC Puzzle: Converting to a religion of peace leading to violence? 
117, Sigh. 
701, Wrong. Apostacy is the equivalent of leaving America and becoming a citizen of another country. There is no penalty.
10208,Hoping editing might be to blame but srsly #katandandre need to check themselves! Can't wait till they're out cooked by the other teams #MKR
4041,It's not even pastry! #mkr
239,Do you think for each of these cook offs they get help from anyone with their choice of dish they will cook? #mkr #mkr
1433," The Jews are the population that has been ethnically cleansed by the Muslims, microbrain. Find me some Jews in Saudi."
4357, People who hate the Nazis are not extremists. And there is no diff between Islam and Nazis.
5453,Kat the contradictory cow. Says she regrets voting strategically but does it again #mkr #mkr 
2078, That's a huge pile of shit. The only reason they would do that is so they could force them to pay Jizya.
6092, so it causes problems with other bots. :\
2400, Annie &amp
4464,I don't like wishing ppl bad luck but gosh I really dislike Kat and Andre. Much worse than tennis man! #mkr
1171, Gee that's as bad as your Muslim friends murdering Christians and Yezidis in Iraq and Syria - the horror.
2653, ISIS behead street magician for entertaining crowds in Syria with his tricks - which were 'an insult to Islam' 
1114," ""Teach your sons to respect women"" ... ""My moms a slut"" #epicfail"
