,text
319,". Go ahead. I'd be interested in seeing what you fabricate. Hopefully they will be more creative than your ""articles""."
640,Shoutout to back when GamerGate thought forking #ggautoblocker's repo excessively would make me renounce open source.
3563, Some day I will go out of my way to piss on his grave.
875,#mkr you need to fix your voting system so it can't be rigged like this
2339,NYS tweets have tripled since #LawAndOrderSVU.
4872, Looks like the Kurdish girls are going to chase the Daesh all the way to Raqqa. 
1900,"Oh. How strange. Nero, glorious leader of a campaign that is supposedly not about harassment, is mocking harassment. "
4190, &gt
3483, I guess the Saudis are almost as absurd as some of the stuff RT publishes.
1355, will send an email tomorrow morning 
444, The Peshmerga and YPG/J are the only ones that have proven that they can be trusted with weapons help.
4383," If you're being spammed when reading #GDC #GDC #GDC , try using the #ggautoblocker shared Twitter blocklist at "
1597, Female President? Im not sexist but this country ...... Ill just reserve my comment
155, You cannot make this shit up. It writes itself!
3573, My suggestion would be that the Kuffar bomb the Kabba.
107, Muslims say Islam gave women rights years ago. Khadijah (Mo's businesswomen wife) had more rights before Islam 
3706," Wrong, ISIS follows the example of Mohammed and the Quran exactly."
185, ...and yet...
10442, ...Hindus and Christians for blasphemy.
4306,Call me a misandrist but men in hardware stores amirite Call me sexist but shopping with women can take centuries &gt
1565, gross. netware.
5318,"Seriously, if Men at Work can be sued for the ""Kookaburra"" rift, then #masterchefau should be able to retire after taking #MKR to court."
902, A lot of most vocal supporters are #gamergate and Men's Rights Activists. #stopwadhwa 
1218, I fucking love her. She is hot as shit.
639," men are the ones that are going to push the real change. they are the ones in power, generally. we need their help."
1772," For example, should I tolerate people who kill people for leaving their religion?"
1865," consume_all vs consume-all, doesn't mention model name must be first."
1743, What the Americans did in Iraq was allow the Iraqis to elect their leadership. Sunnis and Shia killing each other is Islam.
2086, email is randi 
328,"The shadows are going the other way now, time for some lunch #Mkr"
257,Can someone smash that bottle of Rose &amp
5360, maybe someone will use Kat's weber #mkr
478, #GamerGate Analytics for the last days. Tweets from &amp
1914, Read Ibn Warraq on the treatement of Jews and other minorities in Muslim history.
1467,It's the Victorian thing and the fact that they're not Kat and Andre lets be real here #mkr
2867," There was no US coup in Ukraine, microbrain."
6362, And they will be unable to pull a nation together after ISIS if they don't stop the sectarian killing.
5774,OH NO!!!!! ( she says sticking needles in her eyes!!)#mkr
647,This team score is disgraceful #MKR
1135, you too!
2430," Well, Well, looks like one of the so-called innocent Muslim students who was gunned down had some very pro-Islamic "
2134, The fact that ISIS were killed in #Mosul by a chlorine depot explosion is what you call Kar...
5362, Without Muslims science would be exactly where it is today. They made zero contrib to comp science
4072, Suddenly the Daesh murderers of children pretend to care about children. But it's just propaganda.
4847,Ew Been going to social clubs since i was and to see women in the main bar is mad like just not right. #notsexist
3651," Not sexist, but I'll never vote for a woman president because I don't think any woman is mentally stable enough... Maybe..."
1709," No, I think the extremism precedes the bombs. And what would American bombs have to do with Sharia and apostates"
6226," How about next season you hold off on the scores until all the teams have cooked, so strategy plays no part. Food does. #MKR"
2566,THIS FUCKING POTATO IS BLOWING MY MIND. Duck fat. You guys. FIGURATIVELY DYING OF BLISS. 
57, pretty sure dudes are constantly pissing in public
1815, Why do film bosses have to make life weird #Ghostbusters with an all women cast... Why...Not sexist but it's just odd. Would ...
2487," So, are people who support murder for apostacy guilty of anything? "
1038, Three Jewish tribes lived in Medina before Mohammed moved there and attacked them
399, gaters trigger too many false positives. He would lose his valid follower base.
4989," Love it when these idiot national leaders claim that terrorism has nothing to do with Islam, and not one has read the Quran."
471, I bet Choudary didn't sign that Fatwa.
10851,RT Ok so i hav a girl replacin my battery its kinda strange......#NotSexist
2076,#mkr #katmkr 
815, I'm not liking them very much.. They are a bit mean.. :/ #KatandAndre #MKR
1534,I wouldn't order anything on Katie and Nikki's menu in a restaurant!! #MKR
1938,"""Crumble, curd and cream"" - a description of the girls' dessert but also their reaction to Collin's inevitable scathing review. #MKR"
572,"""We know that you gave it everything you have, meaning it's just innate lack of ability that cost you"" #MKR"
4562,You have the paddle upside down in the ice cream machine! #mkr
3445, here is the room at #GirlDevWeek #DevWeek 
2789, Girls that are cheering for a team bc they think one of the players is hot need to get back in the kitchen #NotSexist #JustTh...
5332,MANU JUST SASSED KAT AND IT WAS THE BEST THING I'VE SEEN/HEARD. Viva la France #MKR #mkr 
4770,Kat you truly are a bitch and the lowest form of a human being. The only saving grace is that the other teams can cook #mkr
2259, ROFL. 
4414," Printing some BS from an unsourced, US hating conspiracy nut like yourself does not constitute evidence of anything."
1449,"if you want, you can classify an influx of notifications (dogpile!) as unintentional DDoS, as it makes core functionality unusable to you."
2919,. I was sure it was fake...until it went too long...no one works that hard on a Poe...just vapid childish PC trash.
6637,"totally forgot how that jerk invited me up to his office, too. lol no. my time is worth too much. #stopwadhwa "
3350, Sassy.. More like trashy #MKR #MKR
4942,*sigh* oh Colin #MKR
2310," Y'all can exit this conversation because nobody likes a feminist you piss everybody off,..."
1917," You dumb asshole, he legalized slavery, he raped slave girls, he was a pedophile. How can you call him great anything."
2616," Is Assad Syria, microbrain?"
5849, that is good to know. 
1612, #RapeIsWhen proving you're not lying is a higher priority than proving you're not guilty.
895," I'm not sexist, but cut it out with the whole sideline reporter nonsense. They are absolutely useless and take away from ..."
167,People keep asking me about the stuff I posted about that site &amp
860,"#YesAllWomen are going to shout over wastes of carbon material like until they are heard. You are a drop in the ocean, pal."
4591,#MKR Kat: the Wicked Witch from the West
10111,RT Call me sexist I don't care but a Pakistani girl should know how to make Roti
3325, I'm tired of folks pretending they act right when WOC are in danger
398,Pancakes a winner with the kids! #MKR
52," All I can tell you is that if you really want to understand Putin, read Masha Gessen's book."
11297, Appears to refer to the idea that denial of visitation can be prosecuted under child abuse rather than specific laws...
1167, Make liberal use of the block button and think of the kindred spirit nodding vigorously while reading the TL.
2684, Oh if only Colin washed his hair! #mkr
1933,Leaning in isn't a bad solution. It's just not the *only* solution. It's expecting women to solve all the problems.
4482, That's an easy link 
4146,#mkr #mkr BYE BYE MY KITCHEN RULES!!! HELLOOOO THE BLOCK!!! #TheBlock
1477,RT!!!!! Call me sexist I don't care! But NASCAR is a mans sport!!!!! #sorrynotsorry
1632, Mass grave containing bodies of Christians found in Mosul - (MCN) 
312, Don't talk to me about privilege. As a kid I lived well below the poverty line. No matter where I am I won't forget wome...
2546,I'm annoyed to have missed this live. Need some bitchy. #mkr #mykitchenrules #mkr
1847,"""You confuse me, but in a good way"" #MKR "
867, Again you are a liar because you ignore the context. Here is the truth. 
2205, And they all use the same barbaric Quran and Hadiths and they all abuse women.
2581, 
2365,"Wow, really digging deep there. Ask yourself WHY, ALWAYS. Not sexist, but i prefer to read books writen by men"
244,""" Have you ever been threatened with rape by a woman? #QuestionsForMen"" Yes. Many times, but ONLY by feminist women."
2027," shhh, you're going to hurt their narrative! :P"
1207, lines of tequila driven perl. Good times.
1740,Seriously! two couples who could actually cook are gone while two others clearly should not even be on the show reputations in ruins #MKR
2075, I read the Quran and the Hadiths. Disgusting and inhuman.
10969, Look at this ranting lunatic Palestinian. Interesting what he tells us. 
2496, Oh thanks for clearing that up
1284," well, i bought a case of it, sooo.... :P"
800," Do you know that every time you post a tweet, the US gets paid."
2630, Here are the verses from Quran and Hadith proving genocidal aim of the Muslim biggots. 
1151," ""climb your beanstalk back to hell"" "
1906, that's never a problem.
976,We're already privately working with a number of tech companies. Relationships are being built. We're making HUGE amounts of progress.
3589, ROFLMAO.
10962,#MKR #mkr even though they are in the same place as me Kat and Andre and Eva and Debra they are way better than them as well
973, Kat and Andre suck. Hope they get eliminated soon. #mkr
2335, #PAXEast Get ggautoblocker and autoblock k Twitter trolls: 
10665, it is really funny all the assumptions they make about how it works - and how much they are wrong.
4571," No Israel is containing Muslim violence through the only thing Muslims respond to, violence."
3699, And I'm sure you came out of the womb knowing how to play video games.
985,#mkr The only thing these promo girls are going be able to sell after this episode will be black hair dye #painfulmorons not #killerblondes
5933," Not that you'll stop whining for ten seconds to read, but Feminists do not owe you their civility."
11169," If anyone is interested in contributing to the project in their discipline, I have an Excel template you can go to town on."
995," But sadly, reporting just isn't the answer. Blocks/mutes &amp; ignoring is the best way to go."
1861,FASSNIDGE! #MKR
4774,"Gonna buy like , copies of LADY THOR when it comes out just to make these whiny teens' balls shrivel and die"
10774, And you know it's not true because you don't like it. You are calling the Muslima in the video a liar. Bye.
150,Is it just us or is #ImACelebrityAU turning into #MKR meets #Survivor ?
6476,"Let's not forget, Kern is the person that said he was fully invested in anti-harassment. Remember the cape comment I made?"
5270,CONVINCED THAT KAT IS SATAN #MKR
438, you don't understand my intent
1838," I expect to see this on an episode of a ""reality"" cooking show soon. #mkr"
10836,Notice we didn't see Kat and Andre in any of those cut aways? #mkr
1928,'Australia's favourites are back'? Uhh.... what?! #MKR
963, Of course it is #Islam. The Quran approves of both slavery and the rape of female slaves. 
2325, All the Christians and Ezidis that are told to leave or convert or die are forced.
6356, ...poor Ben.
1090, This is cringeworthy #MKR
2038,"RT how is this not sexist, but if he only took questions from male reporters it would be? This pisses me off."
4579,FINALLY HOME.
584,"Given that my friend is quite fit and these gaters were not, they quickly departed at the next stop, instead of ""debating"" further."
1388," He incited car attacks &amp; praised synagogue murderers as ""Martyrs."" Now Mahmoud Abbas visits Paris to condemn terror. "
4334," I'm a US taxpayer, and I don't care. We will kill Daesh until the last one is dead."
1647,". I agree. FTR I am no fan of abortion or child abandonment. But, I can't accept him going to jail for not abiding HER choice."
1237,I am really curious as to why there are people stupid enough to believe that Encyclopedia Dramatica is ethical journalism. 
217,What a riveting little lesson in walking the catwalk. Thanks ladies #MKR
1862," HOW CAN YOU PROTEST OVER A CARTOON, SILENCE OVER CHILD RAPE PAEDOPHILES? "
296," And I'm sure you sew all the tiny stitches on your own clothes, not underpaid women overseas."
694," Between , and , would be my guess."
5032,. US is th best place for women. Behind Rhwanda and Ghana. Such bunk. She'll never see it.
2095, check it - 
5337,#mkr Dumb blondes with pretty faces ? Well you got that half right girls :)
6040," i have an ipad, iphone, appletv, macbook air. come at me bruh."
5554, And why do we care about this guy?
1327,"In other words #katandandre, your food was crapilicious! #mkr"
4416, Katie and Nikki... Who's been feeding your egos?? You're really not great looking #MKR #MKR 
2036," She is crying, ""Boohoo, you are terrorizing our Islamic terrorists"""
3667, The Yanukovich admin all together stole billion. And Yanukovich was a Putin puppet.
5974,"Seriously, Kat? Tasteless. You're a grown woman. #MKR"
542, my hair!
10496,They should have made some potato bread and an Ulster fry eh Colin? #mkr
2699," #TwitterFeminism can't convince three teen women to take up computer science, meanwhile ISIS is soooo Christian Grey righ..."
1979," Yep, because Native women's concerns are not a feminist issue. Thanks, White Man!"
1024,"The question is, how hard should we work to keep the Muslims from killing each other, since they seem so determined to continue. #Islam"
2111,Kat so full of grace. Not. #MKR
4533,"Want get men approach other men on buses, trains, and sidewalks pestering them b best friends, / and see how they fucking like it."
6920, Every child that is brainwashed and never given a choice is force.
2407, but LFR is derp.
1210, This is kiddie stuff compared to what Muslims do every day. 
1659,"Islam considers women as one big sex organ, so no part of her can be exposed. This is a reflection of the perversion of their prophet."
1477," Why the hell are the contestants surprised about this 'redemption' round on #MKR, it happens each season idiots"
6759, Nobody cares. The law protects women. Mohammed's phony laws abuse women. #Islam
367,"Miss has just asked, ""Why didn't they do the sorbet first to ensure that it's frozen in time?"". #mkr"
1609, The command to fear Allah is all through the Quran. The ritual of groveling on the ground is one of fear. No personal relationship
6500, If you harbour any doubts about what % Muslims believe sharia note this data %/ . million nontrivial 
66, Valve gave the ability to prevent specific curators from appearing on their games' pages. Devs: you know what to do abo...
10624, i can't wait! :) it's going to be awesome. great meeting with you.
2516, Identity of Women 
4772, that's... actually kind of interesting. i'll give them a call later next week. i need to talk to them anyways.
5936, No. Valid point. I have never actually seen an MRA say he hates women (openly) like #KillAllMen etc.
1266, #Iran ISIL burns Iraqis to death for not pledging allegiance: ISIL Takfiris burn civilians... 
5469, The murdering Muslim blasphemy mobs of Pakistan. #Islam
1833, Israel has been attacked by multiple Muslim armies on multiple occasions.
10202,RT Call me sexist but I just can't stand women auto journalists. Something just isn't right about it.
5711,Damn this means j have to see more of their faces #MKR #MKR 
2456,Even if i didnt like their food.. id score them an just because i hate kat and andre. #mkr #strategic
1162," For example, Muslims claim Algebra, but the Greeks and Indians were making good progress on Algebra before Mohammed was born"
6201,Fragile masculinity is my favorite thing. It's so INNATE and EVOPSYCHMAGIC and yet ONE FALSE MOVE and it is GONE
10423, What about young men who don't want to be fathers? Any help for them? #WomenAgainstFeminism
2602, That explains his dedication to Islam.
4520,Good lord Bianca is so done with this fool #drasko #mkr
1730, The Muslims have never stopped their quest to exterminate Jews. #Islam 
2890," The first Crusades were by the Muslims microbrain, when they invaded Europe and plundered all the way to central France."
1169,Downside of using is that I have to create a new twitter account for each block list.
1766," oh, gosh. i hope you feel better. :("
360," Always marching, just never against extremists "
1160,RT People are taking this Chris Paul thing way to far #joke #NotSexist #JustComplaining
3267, BS. Islam declared war on all humanity years ago. Finally the world understands it and will turn you to fertilizer.
2882," I just wrote this this weekend, it might help! ;) Some support whole disk, or at least..."
1946,Our favourite teams pushed to the limit. So Kat and Andre will have to cook weetbix and milk then. #mkr
267,#mkr hey Kat. ure a c$#t.
4160, anything i say publicly gets quoted by the press. randi 
4804, Islamophobia - fear of this. 
722," ""Why Are Women Asked About Their Dresses on the Red Carpet? Sexism!""/""Our Five Favorite Red Carpet Fashion..."
2613,Throwback to when vivek offered to show me around SU to shut me up. 
5012,Good breakfast ideas with vegetables. Vegetable fritters with fresh corn yum #mkr
3862, More Muslim women being treated like Queens. 
1224, They just produce Islamolunatics. 
1635,""" Here come the #hungrycampers! #mkr"" #breakfast#hungrycampers#MKR"
1785, The fact we are forced to pay a license fee to is a disgrace 
2157,"I guess it's one type of strength to make it this far, another to recognize the problem &amp; speak out, not playing boys club games."
1948, The majority of Muslims have already shown themselves to be radical in polls. 
2567, #isis #muslim #Islam 'No Compulsion in Religion' (Qu'ran : )? Think again! 
1123,Maybe the girls should have less tickets on themselves and worry about the cooking. #MKR
1190, i love those too much. TOO MUCH.
1664,"*sees Mother Jones article titled ""Feminism needs men""* *laughs* *closes tab* *smashes window*"
11010, ...that Blumenthal doesn't report anything to the police because he doesn't have anything.
6379, Haha 
33, I guess it's time for you to learn about racism in Islam. 
1245, ...in her mind. Sure.
10406," The best part of a woman's body is their hands, simply because they can make sandwiches and clean shit with them #notsexist"
478, The Department of Justice report says blacks kill at times the rate of whites.
2259,#ff (i mentioned her twice because she's rad.)
1723, I sort of grew up in it. :) 
320, There should be no freedom to impose your religion on others. And that is what Islam is about.
1305, Oh no! Another one of Mullah Oktar's mindless bimbos here to repeat what he told her to say.
3256,I've never liked maple syrup with bacon. It ruins two great ingredients. #MKR
2522,Eugh piss off kat #mkr
5562," No, the quotes mean exactly what they say. But most people are naturally less hateful than Islam"
1247,"Fuck you, fuck you very very mu~ch, Lily Allen. Your latest video is racist and awful and does nothing to promote ""feminism."" Christ."
415, Good. Send me a fee copy. I'm running low on toilet paper.
931, used to be
10604," Sorry, is it Olga, or Tanya, or Lena, or Marina. How's you little Putin sweat shop? "
6788, i care that she wrote a medium piece throwing all of us under the bus.
10325," Remember everyone: % believe in feminism, ..."
10174,"RT im not sexist but girls should not rap, its weird"
1930, Are these the Arab citizens that cheered and joined ISIS when they were exterminating Ezidis?
3607,Omg Colin's been drinking the coolaid #mkr
3041, Of course The old leach Mohammed gave himself permission to screw pretty much whatever he liked. 
77,It's blurry because they were spinning in circles.
4871,Also - I'm thinking that another SJW party may be happening soon. Perhaps after GDC?
1576," Fems, for the love of God, please stop propagating the wage gap myth. #FemFreeFriday "
597, Not all Muslims are Terrorists and not all Men are Rapists. Discuss. #richarddawkins #atheist 
2318, EDITORIAL: Murderous soul of radical Islam has attacked the foundation of Western civilization 
2696," trying, but it's a Lane Rd. And pretty much everything is fucked."
5550,getting a puppy today getting a puppy today getting a puppy today getting a puppy today getting a puppy today getting a puppy today getting
4411,"Why do ISIS, the Saudis and the Taliban imprison women in their homes? Because the Quran tells them to. #Islam #Iraq "
1005, omfg #wowdrama I AM LOGGING IN WAIT FOR MEEEEE
1710, Doesn't stop all-male women's health panels in Congress.
10711,#MKR Kat is better TV. She is a natural villian unlike Ash who is a fake one.
832,#kandre #dilusional #MKR
6643, Another guilt feeling fool. Islam attacked and conquered / of Christianity before crusades.
10445, gas is pretty cheap right now
6418," And if someone risks their life to save me from a mass grave, they are welcome to my TV and toaster."
10284,Saved by the tail of a spatchcock #mkr #promogirls
63," In fact, in a part of the world where Romans kept meticulous records, there is no evidence for Islam until the th century."
4717," And while Christianity moved past it's barbarity, Islam keeps returning to it."
258, And Blumenthal fights for the abusers of women. 
371,Kat seriously turn it down... #mkr
3937,Colin says the meat in the thigh was moist &amp
3772,Agreed. Relationships would be much better without any men. Listen I'm not sexist but no girl should be the man in a relationship
3911," Hey scumbag, if your heroes care about civilians, then why won't they let civilians leave the city?"
1542,Not sure how much more of this crap I can endure #mkr
10630,Dessert shocker. #MKR
1173,I've also been told that some of the people mentioned in article didn't even talk to her. She quoted them without asking.
1516, #gamergate #femfreq #antisjw 
6718,The visceral hate that men have women is why male feminists/allies need tread carefully. We put ourselves in physical danger doing this.
4137," The nuns are wearing the chosen robs of the clergy, not what every woman is required to wear by the sexist religion."
2283, Girls are ruthless smh 
6340, . That pleased Hitler. Grand Mufti provided Hitler w/ armies of Muslim soldiers from Europe. #Tszarnev 
1763,#mkr 
1637,Damn cyber Saudi-adjacent nations Sorry im not sexist but listening to a eoman calling a football game drives me nuts.
5310, not sure. sounds like he left for good.
807,Kat and andre should be sent home for cheating...twice! #mkr absolute bullshit... they should not see the scores until the end of the show!
10580, Abortion is convenient. Your point?
2319, I don't have a problem getting tech companies involved. The concern is just funding everything.
2941, Let's hope the goat was happy! #HappyGoat #MKR 
6770,My name is Randi Lee Harper. Harper Lee is trending. COINCIDENCE?
1844," Call me sexist, but if you need a specific training segment for coaching women, it defeats the purpose of equality across..."
3895,"I recall an article where #mkr prides itself on doing just season/yr, unlike m-chef's seasons. obv'sly they're playing it out like !"
1123,Drasko is asserting his superiority over Steve as a fellow aspiring chef by making his hair taller with every dinner #MKR #MKR 
2403,"You bloody arseholes Kat and Andre, to score that low is absolutely BS #MKR"
1009,LOOOL 
4693, Pretty much this. 
2066,Ugh Broadway boy is back #MKR
10504,They actually cooked logically for camping Josh/mum whose name I can't remember #MKR
695," Kat &amp; Andre got a right slap there, just wish it was literal! Vile individuals taking great satisfaction in the negative ..."
2551, Women of Turkey march for freedom. Don't let them alone #aufschrei 
2289, Hmmm Thor is now a girl I'm not sexist but I hope this gets explained really well #Thor #Loki #MarvelMovies #Odi...
863, Muslims celebrating international women's day. 
4497,Deconstructed Hot Dog is my burlesque name #MKR
469,Kat survived? Is this real life? #mkr
6432,Katie &amp
2389,#MKR Bloody ads - I read about tweets in the ad break !
2149," Roses are red, Coldlights are blue, Murlocs are bad poets, Mrrglgrgl. Happy Valentine's Day! #Hearthstone "
4236,"""Isn't raw egg in tomato poured onto a plate better than nothing?"" No. Just no. #MKR"
1706," The whole ""apartheid"" mantra is just a way of saying Jews should subject themselves to population imperialism"
402, Name one thing that is not an opinion but is still sexist. I will wait.
823, Annie looks like a mouse #mkr
754, i have never seen a single indication that roguestar is in any way technically competent.
899,"""Radical""? lol no Call me sexist. But a girl playing bf ? Lol no"
404,"Oh jesus, if Lloyd &amp; Drasko meet there will be some serious handjobs under the table #mkr"
1109,This could be close!!! #MKR
1386,"RT I'm not sexist but women get upset with other women for stupid reasons. Women constantly say they have ""haters"""
808, I don't know what I expected but it wasnt Law And Order telling me to give up.
333,Cringing every time I see Kat &amp
4751,Print this on a shirt one day as a font mosaic of all the smug Twitter profile pictures I'm not sexist but females can't drive
1349," There is no comparing the vileness of Mohammed to Jesus or Buddha, or Lao Tse.He was simply a criminal"
1095," gosh, FINALLY :P"
1006,"Here's another woman thanking you. I haven't seen the ep yet, but I've heard good things. Thank you. "
4689, Kurds stretch out meter long flag in response to an earlier #ISIS promise of flying a large ISIS flag in #Kobane htt...
949, Come on. Let's do it one verse at a time. Everybody verify what it says.
