,text
10470, Kybar was attacked by Mohammed. The whole excuse for the attack is a fabrication for which no evidence exists.
1527,Good thing deconstructed only happens in food. Imagine getting a deconstructed house #mkr
797, Mohammed led major military expeditions. Most were offemsive.
5922,The only thing getting butchered is their modelling careers:) #MKR
1249,Not dumb blondes...mmm...perhaps just delusions of adequacy? #MKR
3636,Trapped in a pole-dancing venue with that hotch potch and sausage impersonating food #MKR
1601," Pretty sure white men make more than everyone else and have lowest unemployment, so + yr aff. action program is still working"
10374,RT I swear I'm not sexist but there are way too many female drivers in this town.
308,The prophet Mohammed also had people murdered for criticizing him. So the Paris murders were very much a part of the real #Islam
4498,Manu is apparently showing signs of stress from working with a 'Flesh Coloured Dalek' #mkr
1966," that's his original account, renamed."
2067,When are the food trucks gonna make a comeback? #mkr
10903, #MKR There can only be one #grug so stop trying Kat. 
1205,did they end up making about gozlemes in total? #mkr
3509,I'd be making pancakes too! #mkr #mkr they're the best breakfast to have!
6744, If the Islamofascist lunatics stopped attacking Israel there would be peace.
3152,"Motion to replace ""he's just not that into you"" with ""you deserve better,"" ""dump his ass,"" or ""wow, he's a shitty fuckwad"""
521,"Doesn't anyone have a gif of Manu saying ""no you get out"" cos that would be awesome #mkr"
1125," Which speaks to how FAR they are from having the *remotest* insight into the state of being marginalized &amp; its impact, down to ..."
1636, IRAN's plan to exterminate ISRAEL is no secret except maybe to Obama's administration #IStandWithIsrael #PJNET 
16," Well idiot, I see that every native minority in every Muslim country is a shrinking minority due to Muslim persecution."
725,"Patience wearing thin with all these rounds #MKR. Feels like we'll still be here at xmas 'the absolutely last, we're almost there round'"
162,But wait ... new entries ... from Canberra in meGa cookoff #mkr #mkr 
2845," yeah, we should talk. I was just about to send an email over to them right before I was told it was retracted."
4592, Fucking Kat and Andre. Eew. #MKR
4758, Call me old fashioned..call me sexist..but I feel a WOMAN needs to know how to throw down in the kitchen. And a MAN provides.
4087, #ISIS abandon dead in pre-dawn defeat 
1696, #MKR Yes Annie - a pony is on the menu. God you are insightful.
2672, i'm married with kids. also .
1912,"""On twitter, you don't know who you are talking to."" - oh, this woman couldn't be a software dev. oh lordy."
4993, Why do nearly half of all Muslims want to kill people for who they have sex with? 
847,Celine &amp
1788," This is all you'll ever be known for. Very sad, that, but funny too. :) "
11277,"I planned on getting stuff done today, but ended up sleeping the day away. fu, ovaries. efffff youuuuuu."
5748," No, just Muslims having more babies as their prophet told them to do for the sake of population imperialism. #Islam"
619, 
10223, As opposed to the Genocidal Islamist mega donors that support Blumenthal.
40, Syria Update : Deir Ezzor: Scores of Libyans Killed at the Military Airport * We got you * / / * 
4359, I made ISIS rise? What are you talking about. Islam created that monster. 
10201, 
4003,All of that #BlackandBlue means eyes work better crap was obviously made up by *those* people. Fake science.
1941," confirmed, seeing the same thing in *web*."
2279,Where's Manu? :( #mkr #MKR
2520," People not of the book, like Ezidis, Hindus, were slaughtered outright."
73," On the one hand, I think, no, they're horrible. On the other hand, though, I think everyone should, because it's like+"
1232, Jesus
644,Colin's had two strikes now for his dad jokes. Where's Manu? lol #MKR
114," He's a gay, known YouTuber. I saw his video. Unless he's Brando, it's real."
10919," Kat and Andre are serving ""floaters"" for dessert #MKR "
2095," Muslims kill times that many innocent non Muslims every day, so I don't care."
2705,"We know what online abuse looks like. We've been studying it, and we will create reports and publish our findings."
619,"This brings us to today, when the hero of this story, was on a bus near UGA. Listening to his podcasts, doing his thing..."
185, An Illinois PD studies nine years of their cases once.... % false.
2321, And there is nothing wrong with stoping the Muslim genocide of non Muslims.
5434, I would put cash money on them not understanding your profile pic.
2641, I've met plenty of people educated by private schools who still fail at basic grammar. 
1658, And there goes any respect I had for Emma Stone what in the fuck is this 
4125,"#MKR Stop rolling the sausages like that.... giving me a ""soft-on""!"
2019,The judges are the only ones getting me through this episode. #mkr
4268," Im gay. And I want my kid to be gay, too. "
11067," OOPSIE. Is someone mad? Why are you so mad? Oh, wait. Never mind. I lost interest."
10724,Can a camper please push #katandandre into that lake? Wash that #smug look of their face #mkr
3936," Eh, they all ostensible follow the ideology of Islam. Radicals follow closely, others less so."
1688, You lost the debate when you changed the subject. Which was immediately.
3987, this is my work :)
1891," Gwer is a good example. Daesh had a good plan of attack, but not the manpower to make it stick. So they lost resources."
148," built-in would be good. i can do more with rd party services than i can by providing a client, in the meanwhile."
2261,Sassy? Gurls you ain't sassy. More like bitchy. #MKR
5926,Announcement - Site Maintenance: 
1910,Like seriously if I can just get one racist sexist fuckwad out of a leadership position today
505, Kurdish YPG Forces killed at least ISIS Terrorists in Kobane &amp
837,Just need to figure out a way to hire people without disclosing their names publicly for security reasons. Is that a thing? LLC?
1379,There's still a few teams that need to be voted off the island #mkr
290," i don't think i'm going to be able to record, so if you could &amp; post to twitter, that would be awesome."
1614, Mark Kern is the dictionary definition of 'Willfully Dense' 
10911, Please don't link me to Salon. Might as well give me Putin owned RT directly.
4854," those blond girls make me crazy, they are so annoying #mkr"
851,#bizarresexism I don't know why buy I find a hearty handshake between two women to be very awkward. #notsexist
1426, ISIS breaks into Mosul library and steals thousands of books 
617, 
2192," If Quran and Hadith are full of hatred and murder and if Muslims support Sharia, then the problem is Islam and screw leftists."
862, LOLLLLLLL
4624, Every Muslim state is a nasty place if you are not a Muslim.
6243, Those are ISIS guns pointing at that baby. And murdering someone for the way they were born is sick like your Islam.
6035,White people: Print out one of the many great #Ferguson pieces written by black authors and read it aloud at Thanksgiving
127, I'm not actually a dev. I'm DevOps. I like doing things that I find interesting. This is interesting. ^.^
1659,"Kat &amp; Andre got a right slap there, just wish it was literal! Vile individuals taking great satisfaction in the negative of others. #MKR"
2549," instead, she got a block. Because I'm used to having people shitting all over my mentions. And that's a shame."
2344," Nobody said anything about Jews, racist. We are talking about Islam and Muslims here."
2681, The Winner is revealed on #MKR
837," i really didn't mean to dig on anyone in a horrible way. I thought it was just a bit of snow, honestly. :\"
3312, I FUCKING LOVE LYCHEES IN MY ECIG
1715, yo.
5490, Women in Islam: via 
10832,"Will, Steve and Roberts accent always get to me #mkr"
3711, The Quran is an incoherent piece of garbage created for mental midgets. #Islam
11319," They should call you d , 'cuz who even knows how you're gonna roll."
2904, Jordanian pilot Moaz al-Kasasbeh was burned alive in a cage. 
4905, Israel doesn't control Syria. That is simply an unrealistic conspiracy theory.
313,"Don't wish ill #katandandre, Horrible behaviour, disappointed you are from WA! #evaanddebra all the way #MKR"
1018, A shit sucking Muslim bigot like you wouldn't recognize history if it crawled up your cunt.You think photoshop is a truth machin
2158,"The more companies I talk to, the more I realize we're going to need employees - and a steady form of funding to pay them. Excited!"
858, Muhammad was the inventor of thighing. He started molesting Aisha when she was years old. cc: 
6635, I don't see that as a reason to fear god. Do you think that god is a terrorist?
10467,It is kind of funny how much more body confident I've gotten ever since the gaters started calling me fat. &lt
6703,Colin gave me feelings as he walked out then. Not sure if good or bad... #MKR
669,"What a disgraceful episode of MKR, hope kat and Andre fail and that smirk is wiped off their face. #strategicbullshit #katandandresuck #mkr"
1284,"Nope! I'm not sexist, but only dudes should be busting ghosts. #Ghostbusters"
74,Excellentttt 
2512, #FeministsAreUgly 
1248," remote servers, the programs listening on those servers, a local app..."
2755," , , from me. Below average all over #MKR"
2159,Colin u r kidding - you are so lame - those comments were so made up #mkr
5237, i had a rescue puppy named rj . :)
577, WELL ACTUALLY I'm kiiiiiiiinda a rainbow haired expert.
444,"What a surprise, no one wants dinner for breakfast. #mkr"
27,Kat and Andre must be pretty fucking shit cooks if you need to vote a team ! #mkr #mkr
3921, BLIZZARD MAKES HALFLIFE 
1155,Kat that's KARMA B!TCH #mkr
787,"You jog Colin, Pete can just hurl into his spittoon. #mkr"
3628," You didn't give me a deconstructed lemon tart, but have a anyway, for the item that wasn't on the menu #MKR"
4311, How about feminist focus on females instead of everything men do wrong? Start respecting yourselves then maybe I'll take it ...
1690, It's not Kat and Andre - it's #cuntandandre Tweeps ! Get the hashtag going! #mkr
699," ""women should let the boys have their social media, while they save the world. ~ Enough said. Thanks "
2489,I'll likely be back up in the PNW for conference season.
5657," but if they do, i'm happy to turn my graphs over to twitter's abuse department. i don't think the people i'm watching would risk that."
5176, Michael mutes all women sportscasters #notsexist
621, but right now i'm dealing with friends getting rape and death threats so sorry your anger isn't really a big deal. later.
1508, And the truth is that more Muslims are walking away from Islam than people are converting to it. Education will now kill #Islam
1911,I apologise on behalf of my generation for Nikki and Katie. We aren't all so vapid. #MKR #NikkiandKatie
5015,Which team do you think will be eliminated tonight? #MKR 
2306, -YEAR-OLD GIRL GANG RAPED BY ALBANIANS IN LONDON ...
11265," Again, like an idiot you give the opinions of people like you, with no facts."
10805," That is an awesome rifle, and it costs a ton. I'd love to have one. Make sure they don't end in ISIS hands."
4145," Please stop Comcast from merging with Time Warner and protect Net Neutrality. You were a representative pre-FCC, not a lobbyist"
4763," Here's the trick. When she says she was six years old, it means that she was six years old. Got it cunt?"
1933, I have... a whiteboard. And a mental list that I run through several times a day. I don't know PM stuff yet.
305, There is a secret element that weve decided to add to this dish: thrush #MKR
5174, Can't stand female announcers doing play by play for football. Not sexist but every time I hear Holly Rowe doing a game I ca...
2548,"Pretty fucking sick of this pattern: Many women recount same experience, men insist they're still right in spite of said experience"
1319," In the meantime, the peshmerga are posting pictures of truckloads of Daesh killed in battle."
3090,RT This is when a girl would come in handy #someonecomeclean #notsexist
1042, I've spent more time studying and thinking about religion than you've been alive. I understand Islam perfectly.
764, wtf is going on
463, It's all hot air. Mohammed clearly burned people as shown by the Hadith I gave you.
6114, so happy. thanks!
4637, Stuffing up instant couscous should be an immediate elimination. #MKR
64," Yes, the western world was unaware of the layer of Islamolunatics that lived under the thumbs of the dictators."
356," radial momentum means that it does not fly away. In the same way, both the plane and the atmosphere have radial momentum."
2288,"#MKR hey voice over man, your so over the top now, seriously, you're taking the piss eh?"
3665, The only person indicted in the #EricGarner killing was the citizen who used his phone to record it. Think about that.
775," Considering Kat has no job, probably has heaps of time to read all our awful tweets. #mkr We can only hope #whataCow"
4604,"If you want to win, you win by cooking good food not by sabotaging other people, that's not a win that's cheating, Kat &amp; Andre suck #MKR"
11276, They welcomed Islam with a sword at their throats. There was nothing kind about Islam. It was a religion designed for thugs.
6426, Here it is from the New York Post. 
4118," NOTE: In a spatchcock dish, the pomegranate being the ""star of the dish"" is not a GOOD thing. #MKR"
842, shut up faggot. i shit in your mouth
547, hey guys what's going on in this thread 
2204,#TheGameIHated Ren and Stimpy for SNES. Spent three years trying to figure out what to do in level .
611,"If Sheri and Emilie go home, im not watching the show anymore :( #mkr"
4499,I cannot STAND Kat and Andre. I don't even want to look at them right now. Kat is literally Satan in a red dress tonight. #MKR
2735, Every religion and non religion on the planet is at war with Islam. Every border with a Muslim state is a bloody border
2668," PSA: You can support #Equality, Diversity, Human Rights and Universal Suffrage without supporting the hateful cult of #Feminism..."
2440, why interact with these people?
622," ooo, i like that."
1205,I would eat Annie &amp
2132, Most likely killed by Muslims
2054," but i have only watched morning news twice the past week, so who knows what i could have missed."
4220,Bullshit strategic scores piss me off #mkr
304,"Fuck off, ""obviously"" Obviously not sexist, but I got a tiny chuckle out of this one. Lol "
472, If there's debate over if Oscar movies pass the Bechdel Test because of one line that's a good indication the film has poor re...
5647,Do tell feminist hypocrites who organized abuse report fraud to REPEATEDLY ban of #WomenAgainstFeminism how you #LetWomenSpeak.
1286,Get a grip Im not sexist but my dentist is a Woman because I don't feel comfortable with a guy sticking his hands in my mouth.LOL
4791,But I'm going to have to mass-mute or mass-block. GamerGate would prefer that we aren't able to help their own people.
2225, Pretty sure that #gamergate episode of law and order is basically the new Reefer Madness. Holy actual fuck this exists.
324, This is what Christians and other non Muslims have had to deal with for years in the Middle East.
1217, they restart daily to pull in new tweets.
1999," Here is on the #gamergate nonsense. ""Why We Didn't Want to Talk About GamerGate"" "
2417, You need this to go with it. 
2431,"And for dessert, a dropped pie -like Katie's face #mkr #MKR"
361, Mohammed was a murderer who had people killed for disagreeing with him.
585,"Words were said. The gaters protested ""free speech!"" - alas, speech may be free, but not of consequences."
1176, Think of all the Palestinian Christians that have been chased away by Muslim bigotry.
2744, Possible Solutions to the Problem of the Public's General Lack of Knowledge About Islam #Mo #tcot #sioa...
2355," Probably bcus only fools &amp; idiots take seriously the ""blame someone else for terrorism"" industry. Islam is to blame."
3829, Thank God we've finally got to the point in #MKR where it becomes Masterchef.
4616," Read Masha Gessen, ""The Man Without a Face"""
3379," Idc who you are, hitting a child is worse than hitting a woman...sorry not sexist but this is sick"
3001, Why is it that no other religions have statistics that are even close in the production of terrorism.
193," er, like i would expect."
1067," And your evidence for this idiotic theory is ""it has emerged"" and ""unnamed officials"". ROFL"
566,"RT A ghostbusters remake with Women taking up the roles of ghoul slaying saviours? I'm no sexist, but let's not be stupid, eh?"
6102, She says in seven different Hadith that she was married at and raped at . She says it directly and clearly.
2023," Honest and fair is that Islam is a religion of hate, murder,bigotry and sexism"
4826," wtf does ""identity-sure"" mean? I've never heard this, but it makes it sound like she thinks trans are confused?"
2190,RT Iam not sexist but y do women have the singular ability block the way coz the r busy texting! Make me miss my train y dont u..
210, I'm not sexist or anything I just dont think. A woman protagonist wouldn't fit in with the vulgarity of GTA. Unless th...
10937, Come back for a chat when you get a brain.
2366," Australian Preacher Incites to Jihad against the Jews: ""They Are the Most Evil Creatures of Allah"" #Australia #Islam "
2077, And Sharia says apostates must be killed.
892,Christ those #pancakes look AMAZEBALLS #mkr
10457,"If only it worked that way, dudes. If only. "
4328," I'd be happy to read a post with your view points, especially on whether it was appropriate for TLDR to takedown th..."
2272,Why would anyone loan money to Greece when they can be . % certain it will never be paid back.
5462," is awesome, if you don't know her. Write the truth about feminism."
6217," I was able to do so without a problem. :P But I have pretty strong arms. "" monitor is a lot lighter than the dumbbells I use. :P"
4417,"These two need to be in the dictionary under ""Gen Y"" #mkr"
3502," No, it doesn't suggest that. Islamolunatics and left wing lunatics suggest that."
3545, This hypocritical coward will not put his action behind his words by joining ISIS.
6517,#MKR Lloyds happy with all this meat on tonight's menu
1230,#mkr I wonder when these chicks will get their adult teeth?
6290, Choudary tells the truth about Islam. Islam has no spirituality. It is only about forcing the world to obey. 
1849,We would be much better off figuring out what to do about Islamofascim than ranting about freedom of speech or who went to Paris. #Islam
210,"RT not sexist, but...women drivers sometimes"
11249," someone not yet blocked replied to her tweet mentioning me. couldn't remember who she was, so i checked."
3843, Kat is showing her true colours #mkr
3631,Kat is a sociopath #mkr
2736, Who cares what some idiot said?
15, do you think you're head chef Guy looks like Colin Fassnidge from #MKR....
2631, Objecting to this is what the PC morons of Salon call racism. #Islam 
3685, this comment on this article reminded me of you. Do you stilget DOS mansplainers? 
2824, How unfortunate... they're staying. #MKR
3791,there's also claims that he's made about having a fever... which turned into a heart attack in later tellings of the story? o_O
1021,Listening to talk about how harassment is important. And how we are going to help you through it.
10790, ...nowhere TO go.
669,Still moist and juicy... Let's take a selfie.. #MKR
1478, He is following the example of his prophet who married one of his wives at . They do everything their prophet does exactly. #Isam
2436,Had to tune into #MKR to see what Twitter was on about. Fuck me.
1972,Tried to play Fable Anniversary Edition with xbox one controller. Worked for seconds. Then Steam started trying to call people. wtf?
555,Woo hoo go you humble girls #MKR
2000, Hey please translate this nonsensical nonanswer if you can...TY. 
2447," You have more legal rights than I do, is that OK?"
3064, this made my life #thankyoumanu #mkr #greatestcomebackEVER
2448," ""Females shouldn't---"" "
370,Drasko talks a lot for a bloke who's instant restaurant went south. #MKR
59, what they tell you is their intention is not their intention. 
10560,Perfect way to spend a summer day. 
1401," no one is perfect. We all make mistakes, and then we have to apologize for them. Celebrities aren't special."
2314," And those few discoveries were made despite Islam, not because of it. Islam has contributed nothing to mankind in years"
5464, I think the whole country hates #Kat right now #mkr
971," If I hear ""hot"" ""pretty"" ""sassy"" ""like us"" one more time.. I will deconstruct.. #MKR #killerblondes"
2758," Left-wingers seethe as new anti-Islam Pegida march draws , people in Dresden #PEGIDA "
4457," if you mean they have giant dicks that they're swinging around, yes."
6646," Cleveland, Illinois, Atlanta, Washington DC = grow the fuck up &amp; change the mascots. #notyourmascot"
2975,I Dream of Jeanie's Boobs #addboobstotvtitles
5307, Don't be an idiot. There are more than Muslim terrorist organizations. No other religion has anything close.
5646,"CA works to define their new government. ""A meritocracy!"" ""Yes, of course! How perfect!"" A lone voice in the back: ""Not actually a thing."""
3637, Who cares. ISIS does what Mohammed did. Tens of thousands also do and have joined him. Muslims crazy. 
5890,"""i understand that some women are angry at me, but they [...] don't understand how journalism works."" uh, hi. i'm in newsweek, too."
1106," Then he attacked and defeated the third Medina tribe, beheaded all the men and enslaved women and children."
10846,Not enough Lemon in their lemon tart #MKR woops.
178, The scoring wasn't even done honestly #MKR
785, or in properly angled photographs at low resolution with the brightness jacked up. need this photoshop filter for irl.
1723,Thanks Pete!! Totally don't feel bad about using my fingers to get my food on my spoon now #MKR
1828," Did Stevie Wonder choose these ""models""? #MKR"
2125, Dont even get me started on females man. Im not sexist but the gaming community does tend to be a bit more friendly to ...
6070," Okay, you had your chance at an honest discussion. Now you are blocked."
27, probably uses ggautoblocker (which she authored) which blocks lots of innocents. totally not ...
1991,Katie and Nikki go down. Maybe not well. But down none the less. #mkr
10893, This video of the Peshmerga decimating ISIS is far more interesting. 
1021,Absolutely #blondemoment #MKR
2671,I don't really understand why everybody seems so okay with that.
2119, just stating facts b
10910," Yes, I hate the religion of hate."
2249,Booo Kat and Andre did not deserve to get through #mkr
2694, The menus look like they were made by a year old little girl...in this case just the mental age of a year old girl...
10189, Im not sexist but women do not belong on ESPN as analyst or commentators!!!
1995,If someone has to get the highest score in history: It better be Eva &amp; Debra or Sherie &amp; Emilie. #MKR #MKR 
1319,These two are revolting #MKR #MKR 
1857,haha 
10607," it is just short of paying my rent after all fees. so... i can't complain, though. it's doing better than i thought it would."
4638,How many people lined up for Ash and Camilla because they thought Ash was the Paddlepop Lion? #MKR
122," And the civilians of Raqqa didn't join them, they were taken over at gun point."
2361, #MKR OMFG WHY would you kiss the table?.... WAITER.. Bring me the pine-o-clean
4881,#mkr love this show
3562, The fact that I have a brain prevents me from accepting Islam.
1072," mostly entertained at how they think it's going to bother me. posted myself in a swimsuit on twitter, obviously give fucks."
1953," we'll be making an announcement about that later. Until paperwork is complete, it's all funded by me &amp; the money from patreon"
2341, The job Mohammed set Muslims is not done while Israel exists. 
2349, 
686,"""If we're at the bottom of the leaderboard, we're going home!"" CLEVER! #MKR"
1143, yup. something is happening. not sure what.
3705,GDC was great today. Thank you for letting me be a small part of your world. But it's time to (literally) take off my cape and go to bed. :)
2809, A friend's Facebook acct might get shut down because their legal name isn't the name they use/are known by. Anyone at FB know...
5377,"RT So, totally not sexist, but fouls should be a synonym for women's basketball."
3833," Call me sexist, but it really pisses me off when girls who know fuck all about football win huge bets. #WomenAgainstFeminis..."
3186,Well that's bullshit #mkr. Kat and Andre do not deserve to get what they want.
2196," I don't see any burning civilians, and the picture is not even of a burning house."
2262, I'm standing outside and looking in and there isn't a shadow of doubt that the Muslims of Palestine are the terrorists.
2244,The reason why Katie &amp
251, #Islam is about forcing people to be Muslims. Even your perverted Imams know it. 
4366,Ignore those tweets. Site maintenance stuff. It was autonotifying. Turned that garbage right off.
2541," So true, all women over SHOULD play football, but repeated concussions might make us as stupid as you."
2106," okay. You don't even know what this pharmacy looks like, but you are inserting your opinion."
864, heh. HEH.
1331, 
1047, Hope not. How will she pay her bills?
1185, Lamb meatballs in a library or at disneyland? Whatever you say #AnnieandLloyd! #MKR #tvweekmag
4058,"This lecture is older than most of the people insulting my ""pearl"" code. "
6059,"RT I'm not sexist, but any other driver would just drive not stop every seconds when an open lane is to your left!"
3316,OMG MY FIRST DICTIONARY DEFINITION TROLL &lt
1855," bitch you don't know me, i got more followers than you got cock in your mouth"
