,text
1050,#MKR 
1929, / getting ready for a pounding ...............#MKR #fourinhand # / 
4980," at least he doesn't directly say ""I SPEAK FOR WOMEN"" there. so that's something."
1473, #science
4756," #MKR maybe you girls should go back to cutting up cows and pigs, don't quit your day job!! "
8679,"Huh, funny, I find you the most backwards of all Call me sexist but I think it's backwards to have female football commentators"
9349," That just happened, right? The catwalk?! The cat-bloody-walk?! #mkr"
10977,If there was a god she would have fallen off #MKR
9277, Because if an obvious GA sports nut DIDN'T...that would explain it all.
2406, And that proves what?
716, No the lies that I tell come directly from the Quran and Hadiths. Like declaration of war on humanity 
1101, Why deny facts straight from the Palestinian horse's mouth? 
4060, Wouldn't it nice if Annie ends up in sudden death against Kat? #MKR
5774,OH NO!!!!! ( she says sticking needles in her eyes!!)#mkr
2019," So, you oppose #NoMorePage and the feminists trying to ban it, right?"
638,RT I'm not sexist but I can't listen to female commentators for men's sports.
1103,Look at the darlings of Aussie TV looking fabulous at the races today!!! #SuperSaturday #MKR 
7559, I disliked Annie and Lloyd more. #mkr
6649, #ISIS using retarded kids as suicide bombers is nothing new. When I was in Ramadi they rolled one in a wheelchair at us. Ha...
1270," The Jews that did live under Muslims lived as dhimmis, according to pact of Umar, so they had no legal rights."
5898," I would never, ever want to get into a debate with *you* over whether or not something is blue"
8692, If 'tis ws an #Israeli soldier ther wd've been protests worldwide!This's a #Turkish soldier&amp
7586, Turkey: Police use water cannon on anti-Islamization protesters
1402,I'll just come back after this round. Thanks. #MKR 
8435,"Only if you have privilege. Im not sexist, racist, or have contempt for handicapped people, but a funny joke is a funny joke"
8137,I cannot stop looking at Nikki's dreadful black crooked bra #MKR #MKR 
2691,"Breaking from the whitehouse. ""User Face Designer"" is now a tech job title."
10644,NOOOOOOOO!!!!! I'm so annoyed Kat and Andre are still there! #MKR
8836,#MKR the fat South Africans are feeling hopeful
832,"Hmm, methinks might need to rethink letting the couples score instant restaurants from this season on. #mkr"
2482, Here is report including data that puts the lie to all the leftist assertions about sanctions 
11049,Emma Roberts? #mkr
5976,Nothing beats bacon when you are camping #mmmmbacon #mkr
7834, You only have to count the corpses to see that Islamic extremism is widespread.Jewish not
11121,RT Call me sexist but I just cannot stand female rappers......yuck. That voice though.....
765, And there would have been no Iraq elections. Real shame.
1048, wouldn't that depend on lang? 
4336,What could you have possibly modeled #mkr
5573," yeah. i'm kind of feeling like for what i'm doing, wsp is ok. for doing more granular monitoring, redis would be good."
8685,"Double elimination, its only fair since we had to put up with the loser round #MKR"
10324,Headed over to #GirlDevWeek in a few hours to keynote about the state of online harassment.
9549, Maybe try to educate yourself before you call others names. 
5696,"Once upon a time, in a land far, far away, in the great state of Georgia, yours truly worked with "
23, Live footage of Patricia Arquette asking gays &amp
3896, The Police of #Ferguson are NOW ordering protesters and media to TURN OFF THEIR VIDEO EQUIPMENT! #TeleviseTheRevolution
8051, Had nothing to do with Islam. Mohammed's first wife was a rich merchant before Islam.
880," Call me sexist, but I really don't like female country singers"
6684, 
153, I hate cats.
10710," In fact, I think I'll go watch some Gilmore Girls on Netflix. Goodnight."
4304, IS Executes Seven Women In Mosul For Refusing Temporary Marriage (Rape) 
4059,"On presentation alone, these girls shouldnt even make the final judging. of looked like dog food #mkr"
765, ...Then suddenly their Muslim neighbors are persecuting them and stealing their property.
6349, Israel has to fight not to become a victim of people like this. #Islam
10133, you are literally doing what he says more women should do
4127,Yum! Concrete balls for brekky #MKR
1374,"Aw. I was talking to a gater on reddit for the past few weeks. He seemed nice enough, but he just deleted his account. :\ come back dude."
1754," No, I'd go piss on you because of how stupid your are."
1868, yeah we must play WHO HAS IT WORSE at all times or we will run out of our precious empathy reserves
8455," you should be able to criticize me as long as it isn't abusive. People may argue, but criticism is important."
10408, Someone is going home #mkr ...that obviously cannot cook !
10834,"Bloody hell, another round of instant restaurants . Stop draining it, Channel ! #MKR"
9703, thanks. :)
5034,You have a tail??? #MKR
7994, : gamers demand we stop blaming school shootings on videogames. : gamers threaten a school shooting because videogam...
10178,"Colin: ""make moine a dooble."" #MKR"
2597,"Every time I meet with a journalist that is about to post something that is going to make GamerGate angry, I suggest using #ggautoblocker."
10530," What do you think you are spreading, Muslim bigot. "
1639,Hopefully someone cooks Drasko in the next ep of #MKR
1008,"#YesAllWomen wonder ""what if"" when men harrass, beat, and kill women. What if my brother, what if my father, what if my lover."
65,That's crap Lynn and Tony should have stayed #MKR
524, there's very little in specifics that I am free to discuss at this point. But I can give some overview.
1106, It's like Total Recall but with only two breasts. MAYBE.
1304," That's because it's all about the barbarity of Islam, not the beards."
10725," I'm not sexist, when women do something notable besides give birth I'll give them the acknowledgement they deserve"
170," Look, if all you are going to do is repeat the lying left wing cliches, don't waste my time. Bring facts."
1035," Pirro Ligorio's map of Ancient Rome, which took him almost years after locating ancient sites &amp; monuments "
4686," ""We fought so hard in this entire comp &amp; it wouldn't be fair?"" So, you battled it out in cooks &amp; the girls are also compe..."
1831, Another stupid move by ISIS. This will bring Japanese into the action to help kill Daesh. Daesh brains are fried by Islam.
1371, How can feminists claim we don't have bodily autonomy? Like..being able to kill your unborn kid is not enough for you? ...
687, if the vapid duo of conceit get through tonight I'm not watching again #suicideblondes #mkr
1413, sorry that was stupid &amp
632,Catching the last BART home. So excited! What a productive evening. :)
188, An enemy of is good enough for me...F/F
2389, Sounds amazing! See you weren't inspired by #MKR to do a 'deconstructed lamb shank pie'? ie Lamb Shank &amp
8992,"Had to put a blanket over his crate, but Nimoy slept through the night. :)"
9197, To an extent...we are not exactly overwhelmed with great options/choices.
421, oh my gosh. This is awesome.
7970, they made mistakes in the past. i hope they've learned. but the way they treated the GG situation has been outstanding.
2184," I would vote a / to make sure Kat and Andre go home.. You know, ""strategic voting"" #mkr"
775,Sucked in. Getting smashed by the drunk homeless man! #mkr
1761, Better you go to wiki and read all about Bandera. He held no Nazi ideaology.
8357, Huckabee: US giving Iran and Cuba 'ice cream and candy' 
6607,"This week: incident, devops, incident, journalist, incident, journalist, phd student, journalist, phd student, photographer. lordie."
4138,SO CLEVER PULITZER TWEET I think women should wear make-up while driving. Just so they look in the rear mirror occasionally.
158," oh, those were for reasons. not necessarily with tonight in mind."
10296," lol. time to look at a new social group and write a blocklist, i guess."
2353, Bingo.
11240,#MKR Katie.. trusting your instincts is like trusting the instincts of the Titanic Captain.
19, Antis will stop treating blocks as trophies as soon as feminists stop treating blocks as arguments. #GamerGate
2573," Norm only got the book wrong. It should say Quran, since Muslims have been doing that for centuries."
1733,I feel like pancakes now and it : pm #mkr
139, a disaster i didn't know about. ooookay.
5222, Oh... so Rotherham was Tony Blair/Labours sacrifice of innocent English virgins to pacify the satanic horror of Islam (having ...
8820,LRT did not appear to be snark. o_O. Pretty sure dude was serious.
6074," Okay, so we understand that the Quran makes striking a woman an option and that the woman must obey the man."
6617,Do I need to point out the irony here? Woman driver in front of me. Better stop tweeting and watch out for her. #nosexist
9812," i don't like the women in refrigerators trope at all, but i'm not going to say those comics shouldn't exist."
2651,Katie and Nikki #MKR #MKR 
1893,#katandandre to not score meals on their merits but say it's only fair you stay in the comp is a joke. Karma will come soon #cheats #mkr
1019," Reminder: Nerd Dinner/Tweetup tonight at pm Crossroads Mall in Redmond, WA. #codenewbie's welcome. "
5593, Nope!
7763," yo, you planning on going to blizzcon this year?"
4062,I'll believe #feminism wants #equality when they start demanding death for #JodiArias but...I won't hold my breath... 
5606, #CharlieHebdo I urge the Modi government to show some moral courage and lift the ban on The Satanic Verses 
11168,I love Ashran. 
10431,"NYS ht had died down a lot. Flurry of tweets after #LawAndOrderSVU tonight. QUICKLY, MINORITIES. POINT OUT THAT ALL THESE WOMEN ARE LYING."
5816,I do like Ash and Camilla the have screen presence #mkr
8955, i know that feel.
6139,The skanks are done but on the upside at least we can drag Kat &amp
4456, ISIS follows the Quran and Hadiths exactly. They follow the Sunnah exactly. The evil is in the Quran and Hadiths.
27, probably uses ggautoblocker (which she authored) which blocks lots of innocents. totally not ...
2366,"""It wouldn't be fair"". Kat knows NOTHING of fair! Wtf &gt;.&lt; #hypocrite #mkr"
1899, I don't think you could give me enough money to take that job.
4882,Refined dessert! NOT #MKR
3552, Guy who stabbed two people at busstop has face that says I'm going to stab you at a bus stop. 
8764, garrisons are rad. I am just very committed to upkeep.
609,"ah, Lincoln says he has the exact shirt like Rob's navy shirt, how funny is that? lol XD missed #mkr #RobandDave "
9110,"#KatandAndre: safe one day, but it's not how long you may go, but how far does your knife throw? #MKR #MKR "
9925," After committing genocide and murdering countless civilians, scum bag Deash try to use babies for propaganda."
3611,Thanks for making #mkr an unbearable watch #stopdraggingitout!!
282," No, the Russian terrorists and Russians themselves are the main ones using them."
2166," Thomas Jefferson responded to Islam in , what he did might shock you "
2035, I'm listening to on satellite radio and I'm sorry but these announcers are awful! I'm not sexist but the woman ann...
2274, In honor of all the #womenintech attending # NTC Happy #WomensHistoryMonth ! 
8946," No, they showed you the good face of people. There is no good face of Islam."
4984, Nikki...Kermit the frog called and he wants his voice back #MKR #MKR #KillerBlondes And his face!!!!
965, No it doesn't. Islam is grossly sexist. It is a misery for women. 
9656,"What happened in #mkr, i was at indoor soccer"
783," Sooner or later, liberal Europe must fight back "
2120, The problem is in your lie that the deaths were caused by US sanctions. Purchase of food by Iraq was never sanctioned.
1453,"Those bitchin, big-noting #MKR babes need to fall into an oven, cook better or shut the fuck up."
9128, These seems extremely unlikely. % of the entire female population are rape victims?
10020," It's Muslims that do virtually all the killing. For example, % of civilians killed in Afghanistan are killed by Taliban."
6907," Considering the endless stream of murders against minorities by Muslims, who cares."
9537,Yay Jac and Shaz and Robert and Lynzey! My faves! #MKR
8751,. has either taken to some seriously ham fisted trolling or shes on meth/out of meth which I have suspected about her
4799,Om nom nom nom 
3361," this day only brings fucking madness to guys, gives women the power to do anything, not sexist but it's tr..."
1805,"Kat, you are an embarrassment to yourself #MKR"
3508,"If us women in tech are strong enough to get this far, why aren't we strong enough to mentor, to push for change? No more FYGM."
10099,Kat and Andre staying is possibly the worst thing to happen on the show ever #mkr
7494," ISIS loves killing women and children, so what is your objection exactly? What was ISIS doing when they shelled Kobane?"
11037,The most important thing you can do as a parent is teach your children how to walk in someone else's shoes. 
9010, Steve. Drasko is the male equivalent of those faux models wannabe... #MKR
2761," Missing Person: Dolores Dennis ( , ' ', lbs) was last seen today in blk Baker St. Anyone w/info pls call ..."
5379,RT NOT SEXIST.. But who the fuck gives a damn about the WNBA?
643, Call me sexist but this is exactly why girls should not be taking serious with football! nil down and she's smiling 
11267," So, the hostile help line said hostel?"
11207," i used to talk more shit. now everything is weird. too much attention, i'm representing more than just myself. :\"
8275,"This is the best point I've seen made about #thedress, ever. "
1835, link btw 
2411," If you never compare Islam with a close study of spiritual philosophies, you won't know what I'm talking about."
7433, Just like there was years ago. The flies are free.
1375, I need a meme of that...that's my day in a nutshell.
1171," Nicki explains the complexities of catwalk modelling: ""You have to place one foot in front of the other"". #MKR"
5598," Kathy Sierra on Silicon Valley, meritocracy, and Skater Culture. "
581, But he lied to achieve that peace. And anything built on a lie will eventually fail.
10688,I should stop drinking coffee now.
11100," Men, meanwhile, complain about things of substance, like women's legitimate criticisms of media"
4952, follow for DM please
9422, Really? #mkr
7296," Mmmmm, maple Bacon How can you go wrong !!!! #MKR"
5979,"DID U WRITE THAT URSELF OMG All girls should come with a sign ""you must be this tall to ride my emotional rollercoaster""."
6485,Dictating tweets is the worst.
8516,#mkr Jac and Shaz meal looks really good mum and i want it now #mkr
10982,That's a first.
5229, Nothing has any value for Arabs except the destruction of the Jews. And the Arabs must pay Palestine to destroy em
7975,Breakfast is served!! Which team would you be heading for? #mkr #hungrycampers
1680," To some, yeah..."
4277," No, they had no rights in a court of law and had to hide the practice of their religion from Muslims and had to pay Jizya."
1748,Zoe Quinn and other female game developers speak out against harassment | GamesBeat | Games | by Dean Takahashi 
5790,"FLOSS Weekly, open source projects, and paying the bills "
7153,Get rid of that Kat. The worst person I have ever seen #MKR
10063," And what, pray tell, is their ""place""?"
1598," if i was looking for pitchforks, i'd point out a white dude in a position of power accused a minority of bullying him. :P"
4548, I agree. I can just spot them early. I was right about Gaga.
2634, The crimes of Islam far outdistance any imagined crimes of Israel.
404, I wasn't aware the movement controls on vehicles increased in proportion to the vehicle's size.
9811, Sooooo true.
115,"Wow RT yip. I'm not sexist, but I'd like to throttle that woman"
8649, there should be a link to this in the patreon. :)
206, No. Muslims were too dumb to invent nukes. But they use everything they can steal.
7945, Why?
5611,Celine isn't funny stop it #mkr
6575, I know you can't leave country without male permission.
6844,"#YesAllWomen because once at a Louis C.K. show he said ""how do you make an old woman? You take a young woman and just ruin her."""
628,Here's my review of % of games I've ever played: FUCK THIS MISOGYNIST BULLSHIT *heaves menstrual blood at the screen*
2641, I've met plenty of people educated by private schools who still fail at basic grammar. 
2167," If Tony &amp; Lynn are eliminated, they should just burn the set like the house in What's Eating Gilbert Grape? #mkr"
4189, but he's a dude though. I'm not sexist but I tend to affiliate with the male characters. Majority of com...
6597,Banter #mkr
1119,More BAD cooking from Kat and Andre #MKR
1137, Has Bloomenthal ever written about the endless attacks by his Muslims on Egyptian Copts? 
10579," This cat almost has Smarterchild level AI, but it's still in alpha"
2588," , man. Was hard enough fitting the joke in...accurate historical accounts hit the cutting room floor most times."
9409, 
2436,And that wipes the smile off YOUR face Kat #mkr
5804,"Up next, a series of ""positive"" tweets about women from "
7489,Drasko &amp
10329, yes. yes please. take my money.
11103,Push them through. Come on. #mkr
10572, I'm not sexist but I'm old hat cleaning the car a blokes job cutting the grass a blokes job we have a dish ...
5012,Good breakfast ideas with vegetables. Vegetable fritters with fresh corn yum #mkr
1560, wsp is... sigh. but i'm just using docker in aws with a grafana image. fuck configuring this crap.
6519, Petition to prosecute Islamists who Killed Avijit Roy and Protect Freethinkers : 
8848,Countdown until GamerGate screencaps and starts talking about how fat I am. &lt
3982,So FUCK ROBERT A DOUGLASS
802, And it only took him a year to read it.
4668, Are you so stupid that you don't know how to find your own Hadiths and Quran verses?
10235,I JUST GOT MAD AT MY HAIR SO I CUT IT.
7372, Everybody hates Daesh with a passion and there are a million good reasons for it.
11290, Didn't he say this was a big problem women in Silicon Valley had in that Newsweek article? Being too humble?
10126, We can see that by the Daesh fleeing Kobane and the Mosule countryside.
9331,KAT IS A FUCKING CUNT #mkr
511, The same old lie about property rights. But Arab women had those before Islam.
1051,Dealing with journalists : Don't use slang if you don't fully understand the implications. // 
10086, The Para's here are the elite of the British Army! Most applicants fail P company! I'm not sexist but women will nev...
3964,Soon soon soon
7192," Because, at , I've spent my adult life watching our society try to take away all the rights women gained during my ch..."
11124, Oh good. That get's them out from behind the civilians so that the Peshmerga can kill them.
7620, But look at the reality disconnect. Burak says he is for freedom and against all slavery while at the ...
8,I want Colin and manu to just feed me. #MKR #DreamTeam
2753, working on it.
2603, Just colluding and conspiring with 
162,Screw the Academy Awards. I have much better taste than % of white dudes so I'm going to continue to like things I like SUCK IT
9955, a *really bad* data scientist that is yelling about harassment because i pointed out flaws in his work lololol
10019,Hope the blonde cows don't make it through! #MKR
2662, but daaaaaaaad
514, DISCRIMINATION
1883, the use of the word 'bully' in this context is worrisome and relevant to any conversation i have.
2450, LOL. Islamist propaganda. 
8905, but greasy haired Colin is a judge so messy yuck is IN #mkr
3937,Colin says the meat in the thigh was moist &amp
7500,I'm not a misandrist but when men get kicked in the balls they should get up off the ground and get back to work!
698," After Liberal Atheist Murders Three Muslim Students who were Members of Anti-Semitic, Muslim Bro... vi..."
3672," Colin, are you having a lend? for main and dessert? Little skill was demonstrated throughout. #MKR"
6651,That's wrong they don't deserve to be eliminated. They did a lot better than Kat and Andre. It's disgusting #mkr
1427, #Kobane #JeSuisCharlie 'Turkish military says MIT shipped weapons to al-Qaeda' 
1099, 
10799, ... they'll go away all by themselves. Cuckoo.
1828," Did Stevie Wonder choose these ""models""? #MKR"
7432,Today is a record high for Oakland. Plz bring back winter.
1599,I'm staring at that bowl cursing myself for leaving engineering and going into NPO which does not allow me to purchase ridiculous things.
5210," And if someone wants to leave Islam, then Islam declares him an apostate and demands that he be murdered."
11286, Islam declared war on all humanity years ago and denying it is simply a lie.
2275," #MKR #killerblondes MODEL? Puhlease. Did the local thrift shop put on a ""fashion"" show. And should we be able to see her..."
2755,Why does kat always need to make big eyes? You freak me out witch #mkr
3786,Ambulance/firetruck outside my building. It is weird how I have to wonder if someone called in a false report on me. Waiting it out to see.
258, Quote: Me. 
2487," (It may seem counter-intuitive, but it has to do with your personal hearing bandwidth)"
2276," Yeah, for left wing scum like you all cultures are more valuable than your own. And ..."
8033, 
666, The little girls draw the highest price because of your pedophile prophet.
4995, Thanks for the heads up!
7895," ""It wouldn't be fair."" Cause voting strategically is fair, right Kat? #mkr"
5506," #MKR Public to Vicky &amp; Celine ""you need to work on your looks"" Pssst she was literally meaning your looks - not the fo..."
2313, And it's not unusual for FSA to switch to ISIS or Nusra.
1567,That maple bacon w scrambled egg and toasted sourdough bread - Rosie's order for tomorrow's breakfast. Done. #mkr
11102,RT Im not sexist but women shouldnt be allowed to drive.
1473, Spead your butt for Putin troll. 
10426,You are a true savant. when i play mortal kombat i only pick girls im not sexist i just like boobs
2570,"Whut Btw Im no Sexist, I jus mean same woman barking in da office, is same one kneeling or submitting in da bedroom..!"
2772," Well, that didn't take long. Good job, "
8796, uh. every dev makes mistakes.
3954,Do the killa models give a killa dessert?? #mkr
240, i'm disc. used to playing with a derpy warr/dk.
2271," Sam, I appreciate you trying to correct people, but please drop my mention :)"
3901,RT Not sexist but women comedians suck
9599,I always get so hungry watching #mkr
9327,"Maybe your program forked until it could fork no longer, and you didn't have restrictions on. Maybe you sent an inappropriate amount of UDP."
4842,Simultaniously exhausted and full of excitement. Can't decide if I want to jump around and dance or take a nap. Such a good feeling.
7604," You are a total liar, just like your pedophile prophet. UN soldiers don't burn people alive."
6523, Does she have a legal obligation to report? I don't think she does...
879,RT It's good to talk with your wife but it's so much easier to say shut up n make me a sammich #notsexist lol
10237,. I know little more than I just told you. I just thought her smiling face of hypocrisy/misandry epitomized modern feminism.
810,There are some annoying idiots in this competition. #mkr
2122, Good. Time to confront the cult of hatred and murder #Islam
1821, Maybe you should take minutes to read about Bandera on wiki.
248,At this rate will they ever make it to kitchen HQ? #mkr
1117, Sure. Why do one third of Muslims want to murder people who want to leave Islam? 
10201, 
7898, A phony prophet trying to gain power through hatred and divisiveness is the reason for it.
667,". I never said men didn't have privileges or that women didn't face biases, but its more / than one way street."
713, Now Muslim terror groups are trying to complete the job of killing or throwing out any remaining minority groups in Arabia.
10968,Self-awareness at critically low levels im not sexist but some bitches are dumb
991, There were never any neo Nazis involved. That is simply Russian propaganda.
4314,. Not true. Feminism is also about getting free stuff and using benevolent sexism/chivalry to their advantage.
7703, Russias army of propaganda trolls 
6250,Mmmm Apple pie and icecream ...I want some. #mkr
9440, Just as I thought. There is no evidence of intentionally targeting children. And it's not even certain it was an Israeli boat.
3488,I'm watching it happen. I'm watching the numbers climb. This is bonkers. #LawAndOrderSVU
8511, It's a shame that you would make the stupid statement that he is protected by the US.
9935, sure!
1795, Agree. The majority of the credit must go to the YPG/YPJ. Risking life in street combat is the hardest part.
1325," I swear, I'm not sexist, but I honestly just cannot stand the woman college football announcer on ESPN "
1639," CAN'T. TOO BUSY BEING A SUPERHERO, RUNNING AROUND WITH A CAPE ON."
6630," Awww, Vivek made a new friend! "
1990, seriously that room is just creepy. like barbie puked all over a porno studio. #mkr
10842, Because the Muslims have been exterminating Jews for years. And Mohammed started he Muslim hatred of Jews.
1384, I'm no sexist but 
2158," UC Irvine, which sits amidst former bastion of CA conservatism, Orange County, is a leftist, pro Islam, anti-Israel radi..."
2722,Making delish burritos with my boy :) #instafood #burrito #mkr 
8197,BULLSHIT. how the fuck do they stay. how the fuck did they get away with that bullshit. ugh no. sore winners too. #mkr
251, #Islam is about forcing people to be Muslims. Even your perverted Imams know it. 
9760, I'm done - won't bother with the rest of this pathetic shit show #mkr
1797,Uh. Why do they not make these for grownups? 
2175, 
5644," it's hard to not have those feelings sometimes. maybe step back/break for the night? or do what i do, use it as motivation."
9543," Saudi Arabia sewer qurans. When you can't express your hatred for Islam in words, throw them in the sewer. "
