,text
1854, what did they do?
630,Get some more fucking teams why doncha? #mkr
2001,"These girls say they're butchers, I once worked at a boat hire shop so I must be a ship captain #MKR"
3998, No they are treated worse. Can't drive in Saudi. Can't leave home without man in many Muslim countr.
2304,I'm sure that sausage on the hotpot looks more like a turd.. #MKR
1786,Police boat looking for a crack whore named kat who's been dealing meth and whoring herself out for a powered camp site. #MKR
6437, I'm not sexist but doing a remake of ghostbusters with an all female cast sounds pretty shit lol if they're tidies could...
10146, To divide?
9446, You choose your religion and Islam is clearly barbaric and inhuman. It has zero to do with god.
5237, i had a rescue puppy named rj . :)
7630, I felt so out of place at that party last night. There again so would any man who stands in a kitchen for that long......
2552, Compare a Netanyahu speech to this genocidal Palestinian lunatic. 
2730,Nah nah nah-nah...hey heeeeeyyyyy..... Katie &amp
8412, But your whole conversation about slavery is phony bull shit propaganda since you follow a slave owner prophet.
4685,I hope Colin doesn't like it #mkr
2584, That's bullshit Colin and you know it. #mkr
7905,Kat just loving the negative reviews. #MKR
309,RT I'm not sexist but is this bitch serious? !! Good luck living alone for the rest of your life. ..
6626,Applicants can receive a code or number that they must use in the title of their resumes/cover letters.
6319,#mkr Awww no modelling tonight? #ThankGod
455,And women don't give a damn about you. Call me sexist or whatever but I really don't give a damn about women's sports.
6866, We hope those gozlemes are worth the wait girls! #mkr #hungrycampers
2519, #QuestionsForMen Do you agree that Porn Stars have been following #AffirmativeConsent way before it was a thing #YesYesO...
8825," Hard to say. I naively had my fun, not realizing the anvil above me. I believe having that ""fun"" is key to later monogamy."
159,"Obviously #mkr doesn't believe in slip, slop, slap. They all look sunburnt."
2161, 'Have the pancakes been activated?' #mkr #petethoughts
9337,"Not only that, but this rocket surgeon apparently doesn't understand the difference between comments and man pages. Isn't he precious?"
8373, Kat and Andre are a disgrace! They should be booted. To score that low to save themselves.....pffft! #mkr
2485," ""I am proud to announce this nonprofit organization"" ""u r fat"" God i love working on the internet."
6899, So now you admit that the Quran sanctifies sexual slavery and try to change the subject.
572,Jeans were a bit tight tonight Andre ??? #mkr #mkr 
10045,Cannot believe those two fucktards are still in the competition. MY MIDDLE FINGER SAYS HELLO TO YOU KAT &amp
1782, You don't need a perverted religion to feel compassion for humanity. 
8427, that's likely the same person i'm talking about.
346,#MKR has to be scripted. Meat girls serving cock who sprayed sorbet all over the kitchen? I've seen porn just like this...
2666," Again, showing you know nothing about Islam. "
1015, Why doesn't she know that her prophet said that most dwellers of hell were women?
4617,That's rounds of instant restaurants... I'm done. You've screwed up #mkr
10366,I am right now watching Enforcers defend Chums on facebook.
6160,"#MKR. Kat, you snake. Even if you win and open your own restaurant. Who's going to go?"
10937, Come back for a chat when you get a brain.
4922, can't comment on that. I have some runway to get my NPO off the ground.
2752," Sometimes I read that people I follow are being harassed, and I just want to wrap them in the love/admiration I feel them."
4879, AHAHAHA!! That didn't take long at all. 
2385, For every Jew like that there are thousands of Muslims like that.
9042,"""We're in our element serving food we've cooked.Which turned out a whole lot better than Plan A: serving food someone else had cooked."" #MKR"
9389,I would love to eat meatballs next time I'm at the library or Disneyland Lloyd. #cock #mkr
11186, Manipulative and threatening BS. Proving that people have to be intimidated into following the god of terror.
1303," LOL this --&gt; "" You walk by putting one foot in front of the other? Really? Amazing advice! #mkr"""
8589, One would have thought that it was impossible for Obama to get any stupider. Diplomacy with ISIS? Hello!!!!
9351," ""ISIS fighters were coming to buy us, choosing beautiful Yezidi women &amp; killing Shiite women"" htt..."
744,Kat and Andre should have been eliminated. They suck. #MKR
8164, ROFL. No one with a brain will want a madrassa education. Will they teach Mohammed's remedies? 
5276, happens to them.
8741, #ISIS We're doing this for #Islam. Western Leaders Oh no you're not. 
9845,So many no names lined up I thought it was 'I'm a celebrity get me out of here ' #MKR
4726," Hey, did you know KS's TOS prohibits doxxing people?"
2245,That entree looks foul &gt
10889, Would rather.
5630,"Hey, blizzard folks! I'm (obviously) not looking to be headhunted, but I'll be dropping by your party tonight. See you there! ;)"
1195, The apharthide is a Muslim thing. They have exterminated Jews and Christians in most of ME.
8864, Cathy Young's article on the Columbia U. rape accusation and mattress carrying is superb. Must read. 
9490,Lol bitch please... #mkr
7129, Obama Halts Israeli Transfer of Arms to Christians in Nigeria to Defend Themselves From Boko Haram Muslim Terrorists ht...
7215, *hugs*
1834," she assumed I was *lying* when I said I didn't know, and that's ridiculous. I've been busy the past week."
2352,"I am physically sickened. I think I'm officially done with this show for the year, seeya. #mkr #onelessviewer"
5264, #isis #quran #Islam 'No Compulsion in Religion' (Qu'ran : )? Think again! 
1690, It's not Kat and Andre - it's #cuntandandre Tweeps ! Get the hashtag going! #mkr
8984, Ew Kat and Andre are still in the comp. #MKR
2282,"When I get home, I have million emails to answer. "
10708, Your sadness is exactly what the terrorists want.
8847,existing *dye*. derp.
176,""" #sorryitsaboy joke means more boys will stay w/o couples willing to adopt them #WomenAgainstFeminism"" "
324," Start by reading the historian Will Durant. His book ""Our Oriental Heritage"" describes the. Muslim invasion.."
1046, wowwwww this whole thread
1683, Has anyone else wondered if Kat has recently escaped the psych ward? #mkr #mkr
8630,Bull! #mkr
2345, Go Sassy Girls!!! Made that Apple Pie KICKASS!!! :D #mkr
4998," Yes, you can lie about Islam all you want and you can deny all the evidence all you want. No one cares about opinion."
6193,"Eat your words Kat, don't choke on them niw !!! Hahaha gotta love Karma #mkr"
1547, last retweet
7073, Nice meeting you too!
6363," Our first dispatch from Keske Junction, outside Mosul, where the Peshmerga have cut IS' supply line from Syria: "
5430, HEY I JUST MET YOU
664,Sure Kat. Because nobody else worked hard in the competition. #FFS #mkr
1660," Islam didn't free the slaves, microbrain. Did your Imam tell you that lie also."
6740, it's like reading tabloids. easy to spend too much time reading garbage instead of doing cool things.
1925,Fuck they're dragging out #MKR
11040,I kind of want to see Kat and Andre go through. Mainly because I think there are many other layers of Crazy-Kat we haven't seen yet. #MKR
873,"#MKR do the blondes keep pronouncing ""porno models"" incorrectly ? Actually that's harsh, sorry to all the ladies in the porn biz !"
6132, I'm not sexist I am sexist I'm not sexist oh wait I am no I'm not whoa whoa whoa who knows if I am or n...
1615, This is too easy. 
1134,Can't watch this anymore ... Cringe #mkr
6960,Yay Robert and Lynzey and Sheri and Emilie are back!!!! #MKR
8899, #feminists when other women don't fall for their shit. #feminism #WomenAgainstFeminism 
2397, What does it have to do with race microbrain?
7583, I could give a f what you think about it. The fact is you can't name anything that ISIS does that Mohammed didn't
8010,"When life gives you lemon tart, Instagram photos of them and add #Lemons, #LemonSwag, and #UJealous. #MKR "
1594, The people studying Islam all have the IQ of a camel. A ten year old could figure out that this religion is evil by design.
5515,Just when they thought it was safe to go back into the kitchen... Instant restaurant redemption round! #mkr
7962,"Voting strategically on #mkr is one of the lowest things you can do. You're sitting bottom of the redemption round, clearly not going to win"
7682, Goodness are opening their Civic Bistro at the Civic! Congrats guys! #MKR 
2079," catching up on WoW, then gonna go poke at my xbox. :)"
82, eep. :(
1088, #Syria #Kobane Update - #Kurds push on to take villages from #IslamicState in their home province of #Raqqah: ht...
7471,"If you have to keep talking about how ""hot"" you are...NOT HOT. #MKR"
2360,"Rape is not a synonym for ""treated unfairly"" or ""defeated,"" got raped by his phone"
5184, #ISISAreMuslims #BanIslam #IslamIsEvil #IslamIsTheProblem 
9258,That's why we have Because going on the internet without fearing for your life should be a basic human right.
2749, He married Aisha at and screwed her at . He was . That is the definition of a pedophile.
3726,omg cringe at the intro #MKR
1647, And do you know why that is?
8143, #mkr Rob and Dave are freakin legends
1077,#MKR can't wait to have Robert &amp
1499,"And just when I thought it was over, they pull me back in! #MKR #MKR "
10678,"To be fair to Katie &amp; Nikki, the combined group score is way too low compared to what they served up #MKR"
8678,a reminder - RTs are not endorsements.
9109, ROFLMAO. So all this time I've been trying to squeeze logic out of a religious nut that is as crazy as ISIS.
1500," Kat and Andre, Annie and Lloyd...sudden death. Please. #MKR"
4576,MORE instant restaurants? I'm so fucking sick of instant restaurants #mkr
2010, I love you NYC. #MillionsMarchNYC #BlackLivesMatter 
3745,". Again, the case is made...unless u delete your tweets trying to guess which one exposes your idiocy. Case closed. Take care."
10140,"If a monk has touch of karma up on someone else and I keep attacking, why don't I get the killing blow credit when my teammate dies? ;D"
6654, NEVER underestimate the power of STUPID people in large groups 
10312,"I preferred the ""Activated Almonds"" Pete Evans rather than this new ""Dangerous Baby Diet"" Pete Evans. #MKR"
10661, but would they cook better than these terrible contestants? #mkr
7310, This article is by a person who has likely never read a page of the Quran in their lives.
6104, I can never tell anymore. :P
1274, 
1203, And we are suppose to believe that the murdering Muslims defended themselves all the way to Europe and India. Bullshit.
1579,Lowest contestant score in this series! #mkr
7112," Baghdadi has butchered s of thousands and conducted genocides and ethnic cleansing, microbrain."
11055,Oh my god.... When will this show end... #mkr
4087, #ISIS abandon dead in pre-dawn defeat 
723," Yeap, Islam is for ignorant butts."
6974,"SWF looking for long walks on the beach with a lightweight NoSQL/kv store. must have good ruby libs, serverless a la SQLite would be a plus."
6311, All the disinformation comes from Daesh. We know that there is no problem at Al Asad.
1383,The kindle has been out for years. Collections have been out for years. Cloud Collections have been out for year. Still shitty UI.
7250," You are lying again, just like a Muslim. The Quran approves of raping slave girls explicitly."
6751, It's not true.
9039,You can't cook..go home Kat and Andre. Slimy cheating humans. #embarrasmenttoWA #MKR
664, You like words. They all say Islam is vile. 
8889,"You're a fucking asshole. Eh, seems about right... #notsexist "
9060,Omg that woman is AWFUL!!!!! #MKR
5043,Another instant restaurant round? WTF. #MKR
10722,"RT If I had a dollar for every time a girl has backed out and almost hit me, I'd have about dollars #NotSexist #ButDamn"
9091, Why waste your time being weirded out by them? There are many fun hobbies that you could master.
1646,This is really Drasco ... #mkr 
2668, I understand it perfectly. But like all Muslims you use Taquiyya to lie for Islam and fool westerners.
2239,I'm still not % certain this is happening. But the delay between sending a tweet and seeing it appear is far too long.
4450,Well guess it all caught up with them in the end @ Kate nikki #mkr #MKR 
8529,"We know about the typo and we'll be fixing it :P we got this together pretty quickly. When we finally make a decision, we move fast."
10845, Send Cantlie back to Kobani for an update report 
8076," Male followers, it's time to collect your trash."
3946,And so we say goodbye to the little butcher girls #mkr
1493," miles... When I get home, I'm watching twister. "
1245, I would rather lose k followers by standing up for others in a bad position than gain by keeping my mouth shut fo...
9932, Wrong again. Islam = Nazism. And Muslim murderers have exterminated Jews.
8205,Victorian teams are doing well. Naturally. #mkr
1386,"RT I'm not sexist but women get upset with other women for stupid reasons. Women constantly say they have ""haters"""
1871," No, being right makes me right. I can't prove that to someone without the brainpower to understand it. It's OK. Take care."
8883,Ash and Camilla looking great at the races today #mkr # sport #flemington
2725,"OH OK This isn't sexist before anyone starts, it's just true..... Female comedians are not funny!! Not one! Ever!"
7028,"RT I'm really not sexist, but most women can't drive for shit!!"
8586, I'm not sexist it's just funny to attack women's rights because they all get so defensive
6470,There's some good info in the Talk section on Wadhwa's wikipedia page. ^.^ Too bad it didn't make it to the main article.
798, This is a list of lies and baloney that you are presenting. It has zero to do with the Quran and Hadiths.
3500, perl requires little logic :P
1540,I still refuse to believe that his real name is Drasko! #mkr
2639, You can never get rid of the radical Muslims because the Quran and Hadiths will always produce more.
8032, gross
7218,"If you're an adult, at least there is wine. Sorry, &lt; ers, you truly suffer the most on this day."
468,"Wow, all the lines they think are hilarious are said by the main female character when she subjects herself to ridicule."
773," The history I claim are historical facts. What is there to ""purify""?"
7499," Mohammed had people,who disagreed with him murdered. ISIS murders the same."
4268," Im gay. And I want my kid to be gay, too. "
1049,I'm really sorry! Do you have a suggestion for a rephrase? Cissexism alert... :(
6427," I get where you are coming from, and it's annoying, to be sure. But it's not considered harassment under Twitter's ToS."
5831, 
9698,"After tonight's elimination on #mkr, there's now only billion teams left."
1810," last i checked, baldwin was verified."
290, Rape is a violent crime. 
1719, In Christians were % of the Palestinians. Now they are %.
2190, And it cost ISIS half their best fighters. The city can be rebuilt - free of the ISIS animals.
11248, sorry 
5390,"Important to note in ALL of these stats, my 'before' is taken from a large timespan. 'after' has been the past h, typically a slow time."
3543, I don't doubt other life but realistically don't think we'll see any evidence in any of our lifetimes so I don't think about it
2077,Colin is fucking high #horseshit #mkr
6671,So I just basically started #MKR. Why are they serving chicken livers? Vomit!
10125,I love little kid 'foodies'. #mkr
1323, And he seems to think that being a Russian speaker means wanting to be part of Russia.
6673," I'm not sexist, but letting the red ranger be female in PRSS is just, not right. The red ranger is always a guy, no exceptions."
5570, ^W is more efficient than ^H :P
1073,RT I'm not sexist but there's not a single women's sport I can stand to sit through
8556,"Yes, men are never dramatic on twitter. Only suspects are white early 's females. #NotSexist"
4715,I don't think men should be allowed to have opinions. Call me sexist but I don't think women should be allowed to grow beards
11258, All religions are not the same. Islam is more violent than other religions.
2272,RT Girls can't catch ghosts! #fact #notsexist #justsaying #Ghostbusters
137,The dessert looked great! I wouldn't have cooked the apples like that... but I want to try that icecream! #MKR
5391," And hating Islam is rational, and therefore not a phobia. "
5116,Ready to run playing as mkr background music #mkr
2418," most diversity panels feel a lot like circle jerks. They can be good, but it depends."
1223, % of his points are bullshit taken from white cis male standpoint. no harassment on fbook? pft. providing ID/addy? NOPE.
6955,#mkr they have no shame!
4067, Of course Muslim religious bigots like you think that is okay.
867,I want Sheri &amp
10430,"Another instant restaurant round? Nah, see ya MKR. Done. #mkr"
1198,This technical failure must make their stomachs churn. #MKR
2571, shhhh.
8769, So secure in his unshakeable faith in patriarchy that he banned me from retweeting his asinine reply
3981," Wait, I didn't realize I was pointing out the ingrained sexism of Dwight Schrute!"
2533, ah hah!
8626,"#katandandre need to stop. Kat can't cook, and her personality is shit. #mkr #mkr "
4032,"Media, microaggressions, jokes, stuff that's ""not a big deal"" feeds the dehumanization of women that leads to their deaths."
11179, mmmm YUM Love chestnut gnocchi ready to be boiled #Aussie #Food 
424, Only when I can objectify the lead will I pretend to care about a woman's point of view. Got it.
3900," #Egypt's military has bombed #ISIS positions in #Libya early Monday, following the brutal beheading of #Egyptian copts..."
2433,"Kat may be a bitch but let's be honest, the blondes weren't too far behind #mkr"
4156,LOL OMG Call me sexist but I don't respect anything a girl has to say about football or sports itself lol
2500,Knowledge and Muslim clerics = non intersecting sets. #Islam
3408,My fave too now bring on the #salmondish #MKR yuuuummmm #peopleschoice 
10518, Make sure to send Kickstarter this link. Roguestar does not belong on Kickstarter: 
10642, You say this based on what?
5193," No, feminism lobbies to have equality vetoed, actually... "
6024,RT Go ahead and call me sexist but I do not trust girls in a gun store.
3419,.....no? #mkr 
11297, Appears to refer to the idea that denial of visitation can be prosecuted under child abuse rather than specific laws...
5661,I don't think misogynists have figured out that saying they won't want to have sex with you is only a bonus for not shaving.
680, #OUTHOUSEPIC #POOP LOL 
6309,"Kat and Andre got through on strategy and not score, how embarrassing. You should be ashamed! MKR or the biggest loser?! #mkr"
10466, No. You have proven your ignorance here to anyone who isn't as dumb as you. It's there for all to see but you don't know it.
7476," no. No no no. I am a sock trollop, don't be an enabler. I don't need more socks after THIS "
4974," Yeah, it says that men can beat women. So what is your point?"
1188, not my field. ^.^ at a guess? you can be just as tied to a pseudonym as your real name - or even more so.
6527,". I just want to reach over and touch her hair... So do we, Laz! Full video: #MKR "
5775," Yeap, leave it to a Muslim to consider stoning women to death as funny."
474,"So she can try &amp; claim innocence, but statistics paint her as being someone to avoid. And I've been in her sights for a while. Oh well."
3935," Ah, you're a #feminist? Seeing #sexism everywhere then, do check my tweets before you call me #sexist Yo..."
1149, 
4767,Meatballs and veggies for breakfast??? Uh no thanks #MKR
6752,I don't think those meatballs would do any better in a Library or in Disneyland or any place really. #mkr
2355, Go and read the Pact of Umar that relegates them to third class citizenship.
1527, Good tweet. But they actually start selling their daughters at .
3553," Go back to sucking off your little Nazi master, Putin. You are blocked."
2197," I'm not sexist, but this is too funny not to share "
7263, you should read the developer policy irt deleted tweets. It should comfort you 
5064,#mkr oh nooo!!!! Goodluck y'all!!!!
7567, Now I'm not sexist but there ain't no woman in the world that can pull of Thor!!! He's a fucking man!! Always has been al...
5742,How annoying is the skinny English bloke #forgothisname #MKR
8442," So you want to be tolerant of ""Islam"" and intolerant of ""religions""?"
4348," Women are supposed to be ""ashamed"" of nudes of THEIR BODIES on THEIR PHONES yet trash ass men sending UNSOLICITED nudes have ..."
10681," Since Muslims don't speak out against their terrorists, why should we? "
1500,"I need to post this again, because I keep re-reading this article and going SQUEEEEEE "
1461," First, Mohammed ejected two tribes of Jews from Medina and stole their property."
9426," Good, that trash should be mocked by the world."
10241, I think your goat is calling you. She is horny.
10052, Coming from a scum bag that practices religious bigotry. 
4434, Kind of like the Islamic world is a prison.
4345,Go ash and carmella #mkr they should cook my breakfast
4361, I have one. I just have to talk to them. Mostly musing.
10433,THIS BOOK WAS PUBLISHED IN ????????
6429,"""just don't"" = the sum total of your unconscious biases I'm not sexist but I just dont like female singers haha"
2649, Call me sexist or whatever but if ur my gf/woman/wife keeping the house(exception our room) laundry &amp
1006, the days where i accidentally type 'to' intead of 'too' are horrid.
1165,Crime against cooking ha ha... #MKR
6215,My new mascot. 
5815, Another round of instant restaurants? Are you serious #MKR? Yawn...
4559," Yes, but it smells great now that the Daesh rats have run."
10539, 
10569, (hilarious side note: that show was my only sighting of a PoC until I was . Backwoods farm country. Saw ep.)
5547," Katie, Nikki and Pete Evans are everything that is wrong with society. #MKR"
7850, They are not protected under Islam. Islam declared war on all humanity years ago.
10929, Objecting to this is what the PC zombies at Salon call racism. 
1495,"Oh no! No churner, good luck to the girls, they are gonna need it #MKR"
6168,"RT Call me sexist, but I'm just not comfortable with ladies reffing football."
7570, PLEASE SIGN THIS PETITION + RETWEET #BanIslam 
1979," Yep, because Native women's concerns are not a feminist issue. Thanks, White Man!"
883," Yes, all that Islam is making ISIS so loving. Idiot! "
9631," Yes, the Quran tells Muslims to murder people of other religions. "
6514,RT Women should never participate in No Shave November. You should only have hair on your head.
1037, No. It's obvious the producers want some volatile action between the women for ratings. #MKR
175,SNAP Manu - best judge reply on #MKR that ur bad score is because of strategic voting.....do they realize they have to cook good well too?
3926,This dessert is making me sad. #mkr
374,RT Lol swear im not sexist but most a yall chicks be dumb af
3843, Kat is showing her true colours #mkr
2480, Why cry when you Daesh scum send year olds to war to die for Baghdadi.
8642, NHL pays back Rogers for new TV deal w McDavid. Sabres get Eichel (sp?) Rekindles TOR/BUF divisional rivalry. big TV markets.
225, i hate when u open the door for a hot chick and then her ugly friend wants u to keep it open for her. bitch open it your...
4128, ...unseated the Muslims in power. Now the Muslims are not in power either.
1100,Fml 
325, I use windows :P
910," And the number of Christians in Israel is increasing, while in all Muslim countries it is shrinking."
7920,"#stopwadhwa because he is developing ties to gamergate. Relies on their support, talks to Milo."
7142, doesn't look like I am.
237,Karma karma karma! #mkr
796, near metreon
11044," Hell, t Muslims are everywhere chanting death to everybody. Jews only have trouble with Muslims. Muslims have trouble with everyone"
7549,"Super excited for the new challenges. Goosies, and its only the trailer. Yayyy! Tomorrow! #MKR"
8419," for futher context, these are the same people that started going through my facebook friends"
4783, ... i hate shadowrun. :P
5433," Islam only served to slow down science. The few discoveries by Muslims were despite Islam, not because of Islam."
5873,RT What the hell man? Making Thor a woman is like making SpiderMAN a woman. I'm not sexist but you just don't do certain things.
6749, notyourshield.
8210," Aussie #mkr judges need to be Aussies I'm sorry"" I'd like to see autistic judges who just call it completely honestly"
10925, and 
8199, ah. well. no one's perfect.
8323," well, find me some tweets where the hashtag is mentioned +us saying something that isn't questionable or abusive?"
10270, oh! i didn't know you were coming to SF. i'm minutes from SF. via BART. :)
7386," ROFL. Good. The more ""huge"" the ISIS attack, the more dead daesh there will be to fertilize the land."
8309,#mkr some of these contestants are idiots. Who eats meatballs in the morning ?
2091,It is called CRACKLING! Stop being pretentious &amp; calling it crackle. #MKR
2541, More men actually die from DV once suicide as a result is factored in. People tend to miss ...
5450, All of you Islamists repeat the same brain dead lines that someone else told you to say. I've seen that one a thousand times.
861,RT Not sexist but I really dislike women announcers!!
1257, hoping we'll be able to release more info soon. :) Lots of stuff in the works. I promise big things.
8006, you've lost yr credibility- for that junk main? Marking models soft after acting tough so long? Poor show #MKR #sellingout
221," #MKR ""everyone under estimated us"" umm bitch you came second last, like literally just survived - you didn't win! My god..."
7445," Free speech, science, AND evolution!? The Fedora Trifecta!!"
5903, ROFLMAO. 
