,text
1366,"Cooking meals for #jetstar? Good thing most of them can't cook for shit, wouldn't want to make the airlines food good for once #MKR"
7628," From reporters without borders, Olga."
11140, DERAIL THIS TRAIN SOMEONE ISN'T TALKING ABOUT THE MENZ
9848, Every non Muslim demographic in every Muslim country is shrinking because of attacks from Muslims.
1735,Happy Halloween! Don't wear a racist costume and look out for your female friends tonight. Big parties are stomping grounds for rapists.
9011,It's like a Greatest Hits Not sexist but women have a weird sense of humor and can't drive
2663,Nikki looks like the kind of girl who would ask if there's anything cheaper than a $ skittle bomb #MKR #MKR 
9002, like they honestly know the most of any women at ESPN. They also just happen to be the sexiest
8832, The college tribunals only apply if BOTH attend that school.
8531,"RT Im not sexist, but girl refs. Really"
7407,Richmond police just made a Kissyface it Leo.
2470, BREAKING :Peshmarga commander confirmed they killed more than ISIS militants in both Bashik and Mawaran fronts northe...
11244,RT I'm not sexist but I do not want to hear a female call an NFL or NBA game.
1168," report it, email me, tell me if you get no response in a timely manner."
8981," a bit of both, perhaps? def yes on the cover, maybe on the content"
425,lol. is she still screeching about me blocking her? what a turd.
9175, You didn't learn anything about the religion. Some Imam fed you a raft of lies to get you to convert
9075,Need a way to switch btwn sets of tabs. Have a bunch of tabs open for a WoW addon I'm writing that creates goog calendar for garrison.
2602,"RT I like to think I'm not sexist BUT...I cannot stand when females who are clueless about sports, talk about sports."
11160,"If u find yourself pouting that no male reporters were recognized at ONE press conference, u just tasted the bitterness of millennia women"
7872, By reading the Quran and the Hadiths. 
2365,"Wow, really digging deep there. Ask yourself WHY, ALWAYS. Not sexist, but i prefer to read books writen by men"
9217," ...She does to the IDF, Hamas would have put a bullet in her head long ago."
1211,Did Celine just make an elephant joke? Girl your making it too easy #mkr
1673, Islam does nothing but freeze the status of women to the th century.
6460,Everyone's face at the table on hearing Kat's strategic scoring delusion. #mkr 
9394, holy crap #MKR
10546,#mkr Vida here 
5962, Where is the evidence?
5921," And looking at your page, I can see that you are in the business of photoshopping images, Islamist cocksucker."
145," Yes, only Islam can generate that level of barbarity, hatred, and inhumanity. "
955,"Nooo, massive forehead stays damn it #MKR"
5558," Why are the dudebros at the office not inviting you to poker and scotch night? Gee, what a mystery #TwitterFeminism"
7175, I see no reason to.
3742,"Arghhhhh I want to kick in the television set right now, Kat you despicable rat #MKR"
9909, Get a psychiatrist.
6744, If the Islamofascist lunatics stopped attacking Israel there would be peace.
11259, &lt
1813,RT // nope. I'm not sexist but I think the doctor should stick with a male
9554,"Hi ho, back to the dungeon we go! #mkr #MKR "
1158, until it happened to us. Not cool.
6722," Our Prophet Our Honor = Rape, Beheadings, and Genocide Our Honor = Muhammad Does not Deserve Respect."
10219,Colin fully channeling Edward Scissorhands tonight #MKR
3914, jesus that looks ugly
4554," and when you have marginalized, traumatized members of your OWN GROUP telling you they're hurt or uncomfortable, you liste..."
164,Alright. Time for me to get off the internet and hide for a bit until I manage sleep. I'll be getting into GDC late tomorrow.
1493,It is fitting that we are now seeing these strong women speaking out and trying to fix problems that others are uncertain of how to tackle.
405, So is a self-declared sexist and says she's the face of #feminism. Is feminism = sexism? #GamerGate 
10333," I have no religion, but I can accommodate Jews, Hindus, Christians, Buddhists, Taoist, Atheists. But Islam is too cancerous"
10258, that was pretty much my thought.
1334,". Hard to say w/o knowing if avg. welfare w/o a dad is &gt; or &lt; avg. CS payment. If less, it would REDUCE incentive."
6962, Refined &amp; pretty....again not the words I'd choose #mkr Fuck &amp; shit would be my choice.
7937,"""I'm so grateful for my easy, privileged life, so I will ignore the millions dying needlessly because YAY BAKING AND PUPPIES."""
2585, any guy who feels he is entitled to your body just because he treated you with basic human decency has a deep capacity f...
8340, Sorry...I genuinely have no idea...real? Not? Best guess...
7200,Cat get onto the keyboard again? I'm not sexist but I don't believe in equality.
124, Making fun of people who have been sexually assaulted is one of the fucking lowest points you can reach as a human being.
28, ...rightS plural...
8424," Yeah, look what corporate media did. "
5118,I really hope Kat and Andre fail in the most spectacularly and humiliating manner possible. Thoroughly horrible people. #mkr
1254, That is a lie. One crate out of went to ISIS.
10084, It worked out perfectly. When the Muslims invaded Europe in th cent only military defeat stopped them.
253," oh. yeah, it's his seconds of fame. he's still hurting after a bunch of senior tech people ripped his ""work"" apart."
673, This coming from a Muslim hypocrite -the religion that declared war on humanity and are population imperialists
1220," Fuck you forever, gamergate "
6988, 
7461,"#mkr everyone is scoring strategically! Get rid of the ones that can cook and keep in Kat &amp; Andre, that can't cook."
5980," Hate Nazism, not the Nazis."
2252,RT I'm not sexist but feminists annoy the shit out of me
433, Ignorance is not a superpower: 
7254, The Sunni Turkmen are genocidal criminals living off loot they stole from minorities. What they want counts for nothing
4531, The highest score in history better be not be the blondes or Kat. #MKR #MKR 
8907,"Excuse me, where is the rave? I was promised a dead mouse. "
317,You'll be laughing last #skankKat #mkr
4825, Muslims have these delusions about producing Algebra. But many others beat them to it. 
9999,SIGH! &lt
4480," Yes, Muslim bigots are murdering Christians all over Africa and have been for decades."
5387," Yes, that is the verse that insults Jews. Thanks for cherry picking."
1071,GET. FUCKING. FUCKED. #mkr
131, i've been told i'm pretty good at drumming up suspense. :)
10605, #adviceforyoungfeminists Learning some history will help you not take credit for things your movement didn't do 
5679," No, I'm not, you cock sucking twink."
11301,"Saw Mozilla and GitHub booths. ""HI I KNOW YOU"""
1638, So you think I have a right to murder anyone who offends me? Are you living in an asylum? Because if you aren't you should be.
3813, What do you want me to do? Hand deliver the Quran to you. The verse numbers are right there. Get a Quran and look it up.
2430,This is fckd!! FCK YOU KAT AND ANDRE #MKR
7390," But by your idiotic logic, if we cannot solve all problems we should not try to solve any problems."
4854," those blond girls make me crazy, they are so annoying #mkr"
1530,Look if the girls stay they won't win the comp anyway so... I dunno dun care #mkr
1444,"As expected, when the terrorist group Hamas won the election in Gaza it was the usual one man, one vote, one time, Islamist election. #Islam"
1739, SO MUCH POCKY
11110, Problem with vile Muslims is that they try to rationalize &amp
1632, Everybody get a little greasy on #mkr
1411, Yeah you are a feminist so shut the fuck up if you are going to be arrogant
6021,"RT call me sexist, but i hate to hear girls argue bout sports"
9823, Just because most men can take sexist remarks towards our gender doesn't mean they're not sexist. We just don't cry
2432, Looks to me like Baghdadi is a carbon copy of Mohammed without the prophecies. #Islam
1225," I'm not sexist but, I bet half the girls tweeting ain't even watching the football, just tweeting when they see everyone ..."
109,Poor Drasko is so closeted. It was all he could do to stop himself from licking Colin's face when he arrived #MKR
8800,"Jelly much, Kat? Andre is no catch. #mkr"
1631, not sure. i didn't see it.
128, What's your point? Islam declared war on all humanity years ago. Time to respond in kind.
5709, I disagree
5813, Burned alive on Jan rd means that Daesh didn't have pilot to trade with the Jordanians as they claimed.
11018,"If you get a follow from yes, that is me. Being a CEO is scary, and I want a private account for yelling :P"
4376," Did he embrace Buddhism or Christianity or Hinduism and become a terrorist? No, it's always Islam that leads to terrorism."
4727,"Gandhi was pretty sexist, but on #ladyghostbusters: ""First they ignore you, then they laugh at you, then they fight you, then you win."""
11276, They welcomed Islam with a sword at their throats. There was nothing kind about Islam. It was a religion designed for thugs.
9043," ...for everyone ELSE, of course."
4111,"I need a gif of a woman laughing derisively while dropping garbage in the trash, because that is my mentions."
5953, And how about if we investigate the hate speech in the Quran. 
3417," Yes, I have read the entire thing. Obviously you saw the cover once."
2783," Yeah, men never comment on athlete's bodies, EVER"
10273, Palestinians don't deserve any more dignity and peace than they are willing to give. And that is zero.
3892, So : tells women to stay home and cover up.
6257," after seeing your philosophy on regulation in general, I think it is pretty disappointing that you are a leader at the FCC"
1776, She didn't do squat to make the US a more decent place. She is one more criminal that belongs in jail.
502, 
2462, Mohammed was a pedophile who married a child. ISIS marries many children. 
5532, I have that ice cream maker. She's got the central insert in upside down. #mkr
7371, I'm not sexist but don't go around saying WEMON are top shit and yous run the world. When it's MEN that literally run ...
9557, And the prophet ruined their faith by raping them.
1941," confirmed, seeing the same thing in *web*."
10138," Jesus didn't murder, rape, rob, go to war or own slaves like Mohammed."
10441," frankly, i'm quite amazed that i'm not on theblockbot yet."
11006," don't forget, we don't even *use* git. That's an export. We use svn. :P"
661," Nobody on the Supreme Court had a clue about what a murdering, raping, bigoted, pedophile he was."
639,How have I never heard of ball culture? This sounds amazing.
3942, What was Baghdadi's org doing for the years it has existed? One shot burst of success followed by failure and retreat.
1251, not really. i blocked her. someone that likes to sick nutballs on people?
4689, Kurds stretch out meter long flag in response to an earlier #ISIS promise of flying a large ISIS flag in #Kobane htt...
3987, this is my work :)
1989," I already read the entire Quran. It is a piece of filth, hatred, violence, sexism, and bigotry."
8606,"Yes, a lot of his followers are bots. We have known this. This isn't news."
383, &lt
2619," Yeah, they could use camels for transport, abuse and rape women, own slaves, grovel to a terrorist god, pay Jizya, what fun."
9793,"Why the hell are the contestants surprised about this 'redemption' round on #MKR, it happens each season idiots"
2776,bro i am so pro i can cook minute noodles #mkr #moreprothanyou
8206,STFU drasko #MKR
8598, Your bigotry makes you attack people who are fighting against this. 
1830, Virtually all the women being beaten and tortured in the world are getting it from Muslims. 
6879, Wrong again asshole. Just look at the Christian vs Muslim population demographic for the last years.
8821,They will make it because they add drama to the show. #mkr
8563," well, that just made my life much easier. :P"
4070, And Hamas trains child soldiers and sends them to get killed for propaganda. 
2541," So true, all women over SHOULD play football, but repeated concussions might make us as stupid as you."
1588, Oh another trip around the country? Will they be cooking shark? Because this show just jumped one and maimed it beyond recogn...
3941, And Bibi is telling Europen Jews to move to Israel so that they won't have to face the same Muslim persecution as in Europe.
1261, from farmers market :) I got a bunch of samplers with different infusions.
6412,why is their whole menu dick related?!?!?! #MKR
1833, Israel has been attacked by multiple Muslim armies on multiple occasions.
164,it's gonna a girls round on #mkr this week but idc bcuz it's time for #revenge &amp
9739,"Talked about Weev &amp; full disclosure mailing list post. Baph doxxing, swat threats. Family &amp; friends being threatened. Being target of a mob."
2328,"""How embarrassing"" is right . . . I would be embarrassed to be you two as well #MKR"
786, #DontDateSJWs #ThatWouldBeAViolationOfTheRestrainingOrder
5027, Israel is zero threat to world peace. Every Muslim nation on the planet is a threat to world peace. 
10813,Nothing like a little Colin to cheer up this mums night after a loooong day #MKR 
6535,Just want to slap the stupid out of these bimbos!!! #mkr
2329, That's because they were safe from elimination as they finished top of their respective groups. #MKR
9165, NOT FOR MUCH LONGER
10208,Hoping editing might be to blame but srsly #katandandre need to check themselves! Can't wait till they're out cooked by the other teams #MKR
6579,AHA BUT NO ONE ELSE DOES #MKR
982, The hatred against Jews and Christians and others was begun by Mohammed. 
9617,omg how do you fuck up an ice cream machine. it's just not possible. #MKR
5764,RT I'm not sexist but most girls = bad drivers
152, Muslims not killing are complicit by silence.Tolerance of intolerance is cowardice.Ali was maimed by Islam. 
1747, And im not sexist but some of these #YesAllWomen posts are just the most dumbest things on twitter
312,Just get rid of the two big drips #MKR
5178, #questionsforwomen #questionsformen Do you view someone less reasonably if they openly declare hatred of your gender? htt...
7358,men should men. Dumb women call me sexist... real ladies respect the traditional values.. men should men and women should be women
2110, And no I'm not sexist. Women are to be treated as any other person on this planet.
1095," gosh, FINALLY :P"
3700, Funny how defenders of Islam like to bring up the crusades. But the Muslim crusaders were attacking Christianity first.
2153,So how many producers did they blow to stay in the competition? #MKR
9366, So the writer of the Quran modeled god on earthly tyrants because that was his image of an authority figure.
4426," As an actual IRS employee, yeah we don't care."
173, 
5477,yeah colin would be looking for more fat in his sausage.... #MKR
9927,WE ARE IN THE WALL STREET JOURNAL!!!! Game Developer: The Gaming Industry Is Not Doing Enough to Combat Misogyny 
1096, But the Daesh are now moving backwards. No one is afraid of them any more.
6577," So when some ISIS ran away at Sinjar, Baghdadi beheaded them. But now he ran away at Gwer...."
5970, Following example of their prophet Muslims are still commonly marrying children. No one else is.
450, First graders asked about the photo of Mike Brown. Such innocence 
8844,Gay fiance is not going to cope being away from the fresh meat #MKR
10907,"WOW girls are better at other things, like school, and being organized"
8694, blasphemy
2729,"Remember, this is the guy that decided was more important than the women writing her book. Tarah only cares about tarah."
779,". Patriarchy is a myth, so the system has no push back &amp; feminists use chivalry &amp; benevolent sexism masterfully to own ends."
10242, Max looks at the genocide of Ezidis and countless Christians by his Muslims friends and writes not a word. #Islam
10082, He only meant knowledge of his fraudulent religion. Mohammed was an illiterate who didn't know squat.
1304, That Daesh thought he was flying to heaven. But he didn't get far. Like these. 
391," i'm not % sure where it started, but it's not going anywhere good."
11084," Dozens of vehicles belonging to #ISIS were destroyed by coalition airstrikes from the #Syrian border, en route #Rumadi."
1928, More left wing scum caving in to the violence of Islam.
7514, usually don't watch female led movies but when it's scarlett johansson.....sole gonna havtoo hahaha #NotSexist
1793,"gamergate just called a ""copy boy or personal assistant"" on chan."
8300, AND THIS IS CRAZY
8091,Ok so I want the gozleme &amp
9328, the Belgium blonde near the end was a great spot
10754, You are a lying bitch. Nothing of the kind ever happened. rabbis from Uk wrote Putin - no discrimination.
1438,#mkr a for that dessert? colin has just lost all credibility
1291, I think the hashtag got some traction. #cuntandandre #mkr
10479,Is it lost on most #QuestionsForMen was essentially Ford's way of exempting her schlocky clickbait from criticism? 
4328," I'd be happy to read a post with your view points, especially on whether it was appropriate for TLDR to takedown th..."
9661,Judgement time #mkr #hungrycampers
8549,i thought noone was eating the meatballs. who's annie even talking to? her imaginary friend?? #mkr
1574,Are you serious?! They're going around again. We might move past the instant restaurants by June... #MKR #dosomethingelse !
2561,"Put a bra on Nikki, you dumb slut #MKR #MKR "
1937, will def be getting back to this though. i think salesforce will be a good idea for us.
210,Blue Bandaids rule!! #mkr
1287," ooohhh the dessert, thought you were talking about Nikki &amp; Katie for a minute #mkr"
6397, uh. You came to me with financial threats.
1593,"Any time a man says his ex was ""crazy,"" run and read this again: "
2441, PLEASE help find my friend's sister.. Signal boost the shit out of this so we can get her home. 
3989, Don't you dare put in the water works Kat!! You're evil!! #cuntandandre #MKR
8330,RT Some girls should not wear any type of tight clothing
7525,Manu sassing Kat is my favourite thing ever #mkr
11027,". Millions of feminists...the majority...do. Whose opinion matters, their millions of opinions or your one opinion?"
525,In case you think I'm joking. 
2198,just eat his dick already drasko #MKR
7029,You're a horrible parent. Call me sexist but my son can do whatever he wants lol my daughter not so much
8999, They use Orwell as a playbook.
9870,IIRC she claimed I went to jail for drugs or something. I didn't read it. She's just trying to make a name for herself w/tabloidism 
2375," But Islam is proud of their slavery, imperialism, and genocide against minorities. The are murdering Kurds in Iran now."
10948,Really Annie a pony? How can it fit in there? #MKR
2531,People who act like they don't understand power relations need to keep their goddamned mouths shut about sexism
6362, And they will be unable to pull a nation together after ISIS if they don't stop the sectarian killing.
6983," women offer to work for free, men presume their worth -- even in settings centralizing women "
10337,Is there enough blue in the wardrobe department!? #mkr
1216,Dumb blondes with pretty faces..? #MKR
805, You fucking liar. He didn't send you shit and you know it. Go lose some weight so you can use a dif...
8739," You just did, birdbrain."
11176, your definitions of masculinity and femininity are rigid and oppressive. Educate yourself.
749,""" #MKR How the fuck do you fuck up breakfast???"" Not surprising for people who mess up a dish they've cooked a million times"
2690,Look mum.. Left right left right.. I'm a model.. No sweetie you're a promo girl... Here's your bikini go sell some shots! #MKR
2278, Same applies to th Waffen SS. They fought for Nazis to get rid of Soviets. They never had.....
6916, why would it?
6611, charity auction. :P
8337," Wadhwa thinks he ""took intense fire"" for helping women in tech not realizing the fire he's getting is for doing the opposite #s..."
7308,"Yeah no male-led empires have fallen, iirc Im not sexist but history shows us that empires fall when women take control of them"
10660, will try that
5259, NIMOY YOU FUCKING PLEB DON'T YOU EVEN WATCH STAR TREK
8494, Here is the scumbag #Choudary explaining that we are the problem after telling us we must accept being extorted by Muslims.
7351," mansplaining mansplaining *slow clap* Ladies and gentlemen, we have achieved mansplaining inception ..."
10057, Hillary simply doesn't have the character to be president. Enough with the narcissists and nihilists. 
9833," Yes, he's vile because he is against a religion that has produced more than terroris groups. "
4978," Go Rob and Dave, do it for the Boys!! #mkr"
4641, tell me what you think about ethics
5132,kat gives me the absolute shits #mkr
1987,SHUTUP ABOUT THE SASS &amp
10261, How Blizzard is taking aim at toxic players in Heroes of the Storm: 
5533," Basically, death for apostacy and for adultery are a part of Sharia. So you can say that . out of . "
9323, huh. i might have to try this at some point.
2454," How would poor Lynn and Tony feel losing to girls who microwaved couscous, used tinned tomatoes, packet capsicum and pac..."
52," All I can tell you is that if you really want to understand Putin, read Masha Gessen's book."
6745, where is the location of tonight's #mkr ?
2347,Show me an ISIS flag flying in Kobane in the last hours Norway girl. One with the camera's date stamp on it please.
8114," ISIS practices slavery and rape, Mohamed practiced slavery and rape."
11120,"Breakfast, lunch AND dinner, #Thaistyle . Why isn't this team on #MKR ? "
2556,I'll be ready for breakfast by the time this episode is finished. #mkr
3668," Where are the Christians, Yezidis and women, scumbag?"
5078," I'm not sexist, but why do feminists complain about everything?? If there was a cure for cancer I think they would moan! Giv..."
2772, Go ahead and remain a moron. Makes no difference to me.
488, Leave it to a Muslim to claim four translators are lying rather than admit the truth.
3854, Marissa. Alexander.
504,"Yo, ladies. I think it's time we sit down as a group and talk about #stopwadhwa . google hangouts, broadcasted."
9941,These girls really put the ASS in sass #mkr
675, stop. 
4738, lmaoo stfu
6856,"RT You can call me sexist or whatever, but there's just something bout women drivers that bug me"
6488, INTERESTING
6681, Fighting for him would mean not forcing him to become a jihadi hate monster. 
1159,I hate kat and andre #mkr
1253, You sound like an Islamolunatic.
2481, he was already given my email a while ago by someone else.
203," Nope. You keep saying that, but we both know you're lying. Show me where I called you stupid."
2664, Majority of Muslims are sexist and bigots. 
1400, FUCK FUCKING WHAT THE FUCKING FUCK BUT THE FUCK THE FUCKING FUCK?! (THIS GONNA TAKE A LOT MORE THAN YOGA AND SOME CALMING...
3641, You mean it shouldn't be? Because it IS consent to parenthood for men today.
10111,RT Call me sexist I don't care but a Pakistani girl should know how to make Roti
7154," Khadgar, you're so sassy. "
74, Which tag are you referring to?
1498, I posted on a subreddit modded by the person that claims I doxxed them.
8621,"RT Girls should not, I repeat should NOT participate in no shave November"
9377, Your prophet never said that. And countries like Pakistan have a % domestic violence rate.
11212,False. Equivalence. I'm not sexist i hate boys and girls equally.
983,"Protip: When you jump into the mob to harass someone, and they publicly call you out as an individual in that mob, it's not the same thing."
10465,hopes Kat &amp
7645,It's pretty sad how committed sexists are to their own denial.
514, Interesting that Kurds are fighting for their own land but the Islamist who support Palestine oppose the Kurds.
5704,Deconstructed lemon tart. Basically a pile of crap on a plate #MKR 
6981," But logistically speaking, the vagina is a tough character. It can accommodate items of size and girth quite well."
1647,"Promo ""models"" are the dangle berry of the modeling world. Shit. #MKR"
2347,"Watching completely dismiss women that don't agree with him, be very disappointed in men that don't agree with him. #stopwadhwa ."
5162, Because nobody wants to claim to be a terrorist.
11089,$ . % certain its gunna be a death match between Kat and Andre and Annie and Lloyd #mkr #deathmatch
8087,Sometimes my mom says such stupid shit that I have to remind myself that I protected her from knowing about much of the horrible stuff.
4015,Yup there still hot blondes #mkr
334," HOW THE FUCK DO YOU PRONOUNCE YOUR LAST NAME I am assuming it is ""Warcraft"""
2613, the ethics policy for gamergate doesn't exist.
3310, you're a dumb bitch too
5828, Releasing private Sony e mails to hurt people is the same as releasing nude photos of Jennifer Lawrence. Why are they ok t...
1052,#mkr #mkrnz #Aotearoa #pasifika #Tatou 
275,These girls are fucktards!! #MKR
4317, I'm not sexist but women do cook nd clean better then us #ItsAcompliment
4917,I know of at least people that are dealing with police today after being doxxed on chan. Trying to be available if I'm needed.
9624," While you're in my TL, just wanted to say TY for all of great work you do challenging ""narrative"" w/ facts. MUCH appreciated."
7540,"What is wrong with Katie and Nikki on #MKR vapid conceit, that's what."
7104," It's not ""sold out"" when you're giving them away for free. #MKR"
2296,#MKR that wiped that horrible smile off Kat's face!!!!
10132,Apparently you are not following the many misogynists I RT Why is everything for girls or related to girls on Twitter? #NotSexist
4428,And now for the dish that best represents the girls...... A big deconstructed TART #MKR
1186,Pretty day in SF! 
668,"Aw, GamerGate harassment squad. Did I say something to make you mad? "
1808, No they don't they share a commitment to the barbarity of their religion. 
