,text
452," These #QuestionsForMen are mostly ignorant &amp; sexist. ""Do shitty things happen to you?"" ""Isn't your life perfect?"" ""How many ..."
2095, check it - 
1608, Stoning women to death have become common in Mosul by the Islamic State. photos published today 
5725,At what point did people start confusing alpha with asshole?
200," No problem, she deflected anyway..."
8677, I didn't acknowledge the fart I DONT KNOW
2061,Now Annie is worried about the blondes.. Too late you dummy #MKR
1667,"She's trying to play it as ""we can have our own opinions but I still respect you"" - No. She doesn't. She admitted that she was selling out."
4753, supposedly battery life &amp
313, BBC News - #Syria crisis: #Daesh (#ISIS ) imposes rules on #Christians in #Raqqa 
9741, I noticed that all the Daesh are running away from the Peshmerga. You can witness it in. Pesh videos.
756, block while waiting indefinitely on data from a filehandle.
4077," Russia, th most dangerous place f media t work"
1306, Objecting to this is what the PC morons of Salon call racism. 
4488, Every single thing out of your mouth is Taquiyya. Blocked.
10256,"Putting them both on the same app secret/key (just diff user creds), adding more sources for gater_ebooks, doing some filesystem cleanup."
4981,*backflips away* 
1229, Your Caliph ran from battle at Gwer like the pussy he is. He can't possible have faith in Allah and be such a coward.
5284,"So Kat realizes that, after her behavior over the last nights, we all can't bloody stand her... right? #MKR"
8512, It's not a race to the bottom. Compare Islam to secular humanism.
8543,The Japanese macaque is an omnivorous animal #sexistfacts
6703,Colin gave me feelings as he walked out then. Not sure if good or bad... #MKR
7333, With so many factual errors piece about online harassment by it's a disservice to everyone 
5957, ? Has Colin gone off his meds? #MKR
1783, NO. NO NO NO NO NO NO NO. GET KAT AND HER STUPID CAT'S BUM MOUTH OFF MY TELEVISION. #mkr
2012,Go girls you got it go gueensland and stop being mean Kat and andre #mkr
1694, And the lying Muslims claimed that all of their attacks were only done because they were preemptive.
2429," No, not going to bed with her is a seperate option. There is no ""mentally""."
41," In the UK like idiots we give jihadis rehabilitation, Jordan execute them. We are a joke "
859,There doesn't seem to be enough of anything. #dessert #mkr
2039, 
6084," A lot of such children are the victims of Daesh mortars, hypocrite."
4580,I just want to knock Kat's cocky face out #mkr
6128,How can you have never cooked on a BBQ before????!! #MKR
2203,Yeah unlike this tweet I'm not sexist but do girls do everything for attention?
5406," Okay, microbrain, show me proof that the sanctions included food or medicine and stop babbling about experts."
1651,Are you upset about tonight's elimination result? #MKR
8433,OMG I just knew they were dumb!!! No common sense or brains #MKR
10310, The Prophet Mohammed beheaded Jews for not being loyal to him. And all the Muslims love Mohammed. So what's the problem?
1862,#KCA #VoteJKT ID pre_dessert: An ad for #MKR contestants was just on TV. Boyfriend immediately downloads the online application.
2606, sorry I'm not sexist BUT there is a double standards there's certain rules for dudes and there's certain rules for fem...
1894,Always looking forward to see Rob and Dave's outfit of the day. Those shirts! #MKR
7877,If it takes so long to make then why did you bother...? #MKR
7452," &amp; if you want to sulk about being called on it, i guess that's your prerogative."
6111,Rose and Josh are great haha. #MKR
9252," it's entertaining, but well... let's just say my entire next week is quickly filling with meetings. no time for gamergate. :)"
8901," You don't guarantee them protection, you guarantee them third class citizenship and extortion."
7758,. Those women are not exploited. They make a calculated choice to use sex to advance careers.
10851,RT Ok so i hav a girl replacin my battery its kinda strange......#NotSexist
5149, because your target demographic is s businessmen apparently. Fun fact: Don Draper fucking loves tea
1625,"In the words of former contestant , Katie and Nikki need to calm their farm. #MKR"
2201, And we fought the Germans for their actions. The first crusades were Muslims attacking Christiandom.
9659,"That's about "", i think."
8730,Really a cat walk that's so ridiculous #MKR 
7903, Good call.
11217, The format to #mkr is stupid. It'll be about weeks until we see the Cowboy and his fit daughter cook again.
7, We only need to count the Daesh corpses every day. 
5978,That's dessert? It's one mouthful?! #mkr
1914," As usual, Piers Morgan learned nothing for the ISIS immolation. #Islam #Daesh #ISIS #Muslim "
9521,Why don't all the contestants just score each other ? That evens the field. #mkr
6742, Or this stuff. 
5051," No, it's anti semitism. This Palestinian leader clearly tells you that it is a religious war by...."
8619,You can tell Rob and Dave are #Queenslanders just by their accents and language #mkr
8627, do you realize how creepy and inappropriate that tweet is?
9528, well technically gif is a hard g
2431,"And for dessert, a dropped pie -like Katie's face #mkr #MKR"
8880, you could just start an ebooks account just so i had more shit to argue with.
3771, You are either completely ignorant of Islam or a total liar. 
2775, And here you are honoring terrorists that your master Putin sent to Ukraine to steal their land. You are filth.
4899," A worshipper of the pedophile prophet has no room to call anyone a biggot, since Islam is a religion of hate and bigotry."
7261," OHIO convert to Islam arrested for terror plot on Washington DC, wanted to shoot President, members of Congress,... "
21, The hate atmosphere is built into Islam. So extinguish it. 
6143, ...and Hillary pro-rapist.
7336, And yet...
3414,"""I'm not sexist, I just become instantly virulent against women who accuse me of sexism."""
4217,Is 'deconstructed' code for 'dogs breakfast'? #MKR #MKR 
4865, The Muslim pedophiles do this all the time. It's so common and accepted that it's not even news.
7166,#MKR is making me feel all stabby right now. #Sassy
10323,"""Follow #ElieEliaWorld Twi Insta ... #_ #MKR"
4549,No. Just no. #MKR
2087," Biurny Pegeuro put a man in jail for years, never even had sex. Lied to her friends about ditching them at a club, so she..."
5006," We do, but I do encourage calling out sexism under any twitter handle."
4115, MT Daily reminder that I % don't care about straight cis Jews's opinions on racism &amp
1603, ele shaman. :)
10597, So. . .the book doesn't exist? That's a pretty weak punchline.
5401," at the very least, it's actionable by twitter. is good enough for law enforcement."
10500,Remember the spot where Cantlie stood in Kobane to announce that ISIS had full control? It's now in the hands of the Kurds. #Mosul
10554,"WE GOT A COMEDIAN OVER HERE Not sexist, But it's a man hole."
2590,Just chilling in #CrabFest VIP with the one and only Carol from houseruleson . #Houserules #MKR 
1001," our court system is failing us by letting these criminals walk free. Victim matters, gender does not. Crime Mat..."
2010,I guess we all hate Kat and Andrea but they all hated the frauleins more.You bitches cant win nor beat kat the dog #mkr #sorrybraunhilders
67, you should bring those up with the mods. they are receptive.
152, I get the sense from his timeline that Vivek is HOPING gamergate goes after Amelia like they do 
4352, The Quran is not a history book. All of it is instructions to man for all time.
1267,I don't even like Ghostbusters but I will see the HELL out of this movie to spite misogynists.
5072, Exactly. Merkel is defending this. And the protesters are called Islamophobes for being against it. 
5275, #MKR Kat and Andre get to stay? Seriously? This is so unfair. So not impressed with the strategic scoring. Karma WILL be...
7632, Her continued production of carbon dioxide.
2447," You have more legal rights than I do, is that OK?"
4778,Wow. I just realize how much life must suck for somebody who is actually named Vivian James.
1764,"Like, that's not even a clever joke??? I'm not sexist, all my favourite films have lesbians in."
1236," given the location of the power button, I may follow this advice."
1145," doesn't really surprise me. ughh. yet another thing i won't be attending. driving more industry women away. good job, "
7249,*cough* slut *cough #MKR
1231, I was never a part of that...
1078," you insinuated twitter raping me yesterday. Also saying only women get raped, that is sexist. Little bes..."
1573,#MKR those pieces to camera are recorded after the event. Kat knows she gets smacked down and she STILL gloats like a crazy Bond villain
142," Furthermore, all the Hadiths about Aisha's age are classified as Sahih - meaning Sound."
10065," And there is the next thing that is wrong with Muslims, most of you are liars. % were killed by Taliban."
6030," turning it into a block list could be pretty rad, too. ;)"
7953, yeassssssss
5004, He couldn't be close to the idiot you are. Terrorism has been rampant in ME years.
2499, He was killed because Putin wanted him dead. The rest is a blatantly obvious Putin coverup.
1054," They should have killed the guy, just like ISIS would have done in a similar situation."
2278,"OK, yeah. No GDC today. Coughing. Too much to do next week, can't risk full-blown ConSARS."
5809, No is right. Welles died before finishing the film.
504,"Nooooo I missed the critique on the entree, missed main now we're onto dessert #MKR"
6217," I was able to do so without a problem. :P But I have pretty strong arms. "" monitor is a lot lighter than the dumbbells I use. :P"
8925," Truth is, I understand Putin is a criminal."
4283, Take me off your @ list scum bag.
7260, harassment panel. front row.
2034," just change your profile pic/name to a woman, pref w/brightly colored hair. Tweet out ""gamers are dead"" or ""games are sexist"""
8066,I had to start muttering under my breath that white people cannot have dreadlocks. Oh lord.
9266, Thousands of Russians march in memory of murdered Putin critic 
1834,"I'm going to lug my macbook air, my ipad, my DS, and my surface pro with me. I need my battle station. This will suffice."
2263,"girls have no sass. with some of the teams left, this could be a long season... #MKR"
6727, ready to run!!!!! Love the music choice. Good luck everyone #mkr
110," VIDEO: After ISIS Burns a Man Alive, Cowardly Obama Cant Even Bring Himself to Condemn Radical Islam "
269,RT If it gets the men out from under their wives feet I'm all for it #notsexist
1809,Get Gordon Ramsay on there he'll sort #cuntandandre out #mkr
7755,Spoiler alert: it won't be you Lloyd #mkr
2632,"Josh &amp; mum have the right combination. Adding extra bacon after a request, is the perfect touch. Well done. People like free add-ons. #mkr"
9984, So exactly what are the Jews holding on to? 
349," And like Russian Militants ""IS beheaded captured Peshmerga POW in Mosul "
7649,#mkr great catwalk. / 
10059, A restaurant AND a cookbook for #mykitchenrules twins Helena and Vikki. #mkr 
1852,She doesn't give a shit what you think. STAGGERING This girl across from me has a jungle on each leg #Pleaseshave #NotSexist
7518,SPOCK DIED???
6, I honestly think Kat has mental health issues. #mkr
5088, But we do have Eva and Debra and they seem lovely #mkr
3696, You and your religious brothers are the real filth of the earth. PKK rescued Yezidis from your animal friends.
1022," yeah, I needed something that mounted directly to my desk. I get bored and move furniture sometimes. :)"
5289,I'm almost in sniffles at the thought of seeing my FreeBSD extended family again after so many years. Clearly I need more sleep.
5933," Not that you'll stop whining for ten seconds to read, but Feminists do not owe you their civility."
1364,"With teams on our screen, it means ONE GOOD THING. LESS KAT!!! And more people I like. #MKR #MKR "
9121,"#MKR I hope no one knocks over those candles on the promo girls stairs, that's a fire hazard isn't it?"
5523, Big news! Wait does kat actually still think she can cook? #mkr
2671,I don't really understand why everybody seems so okay with that.
557,Seriously stoked the girls got through they are pretty and can cook....they are promo models and sassy #MKR
8329,It's unbelievable the way that journalists fall all over themselves to make excuses for the barbarity of Islam. Not one has read the Quran.
1822, but I'd rather watch no name welterweights than Layla Ali in her prime. Not sexist but men &amp
9828, #WholsMuhammad #UElkemdeCharlieHebdoDagtlamaz 
2106," unless you know if kaiser will take insurance that isn't kaiser, my options are exceptionally limited. :\"
2395, are those any good?
9285, To suggest that Jews of Israel should subject their lives to the same barbarity that the Copts of Egypt live under is insane
1908," I (would) never read/see it, so I have no idea...what is the ""abuse"" they speak of?"
3575,Kat and Andre can fuck right off. #MKR
56,#MKR Does a kick ass Apple pie mean its shit?
2351," I didn't realize I was supposed to treat you as a child whose opinion is irrelevant, sorry. My bad."
926, Ariana Grande has no chill lmao 
1212, The reality is that you're sexist
2047, I come from reality.
1922,"#MoreAcceptableThors: Thorldemort, Racist Uncle Thor, Smells-Like-Roofing-Tar Thor, Cocky Lifeguard Thor, DMV Employee Thor"
10589," ...as a result there is a POSSIBLE supply of % of the population for all ""female"" jobs vs. maybe % for some ""male"" jobs."
2368," i almost typed ""is it in the cloud"" forgetting that i have keyboard input word replace for cloud to butt."
2358,"Congratulations Kat and Andre, you came second last #MKR"
8936,Thank you everyone that pointed out it's from tswift's shake it off. This video is my new favorite thing.
8732,I need a Drink or . Watching &amp
195," And without western invention, the Muslim oil resources would be nothing but a filthy, useless liquid."
10458, wait. When did I become a pedozoophile and what is that?
911," i kept being the last person alive AND topping damage. it's like, what. this isn't hard."
5168," A cis WW celeb millionaire Rosie who claims to interview people cannot handle questions on her exploitative upcoming guest, E..."
5589,Dave and Rob playing it safe #mkr #ShakeNBake 
2119, And while all other religious groups globally are under genocidal attacks by Muslims you blame the Jews. Utterly stupid.
2121, I just did.
2739, 
449, Congrats John Travolta... You single handidly creeped out the #Oscars 
7734, But it doesn't matter what Muslims believe or do. It's all okay because they are not white Christian
1039,WTF am I watching...? #mkr
1899,Don't think I have ever seen a nastier piece of work than Kat and Andre. #mkr #oxygenthieves
1457, thats insane! #mkr
10637,"Fun fact: Chris Paul was fined for ""criticizing a referee in a public forum,"" the fine was not because he's a sexist: "
4977, One of the stupidest lines that Muslims try is to excuse their barbarity by Christian barbarity.
9799," You are a liar. The Palestinians never had a country and the Jews were settled, not Bedouins."
2788,Why not just make a tart? #MKR
5770,The amount of Mean Girls mentality coming from GG supporters is hilarious. ON WEDNESDAYS WE EMAIL KOTAKU.
5751,"Just like last season, if the bitter team gets through, I'm not going to keep watching #MKR #mkr "
2665,"Not at my computer. Will report a bug with search &amp; blocks later. Not sure if this is intentional or not, but it seems sub-optimal."
106,Don't mind looking at Collin for the whole #mkr season 
479,Too many bad dishes tonight it's gonna be a fight for the bottom #mkr
108,"We can't even fucking ride bikes now? What the shit is this? I'm not sexist, but girls riding bikes just looked weird af."
10309, I went through that my first night talking about GG when Baldwin started tweeting at me. good lord. that was a bit intimidating.
5476, Nope.
2388,"Trying to get used to putting together and sticking to a project roadmap, since I'll likely be working with others on this soon."
1247," . Most stupid comment. Hitler wasn't religious, that's a Muslim lie. Truth is Hitler admired Muslims "
5025,"That's rigged, they have to keep her in for her mouth, yet their food was shit AGAIN! #mkr"
1463," The more I think about it, it's clear that women created gender as a social construct to seem shorter and weaker to get..."
8746," So they blow up statues and churches and attack civilians because it's all they can do as they ""die in their rage""."
2404,New dress!!! 
1035,I only really have the time to respond to mainstream media. Reviewing everything that GG writes about me would be too time consuming.
2717," No, you are a liar. They are not neo Nazi groups, idiot. That is pure propaganda from the Putin media."
10244," Soggy ham n cheese sanga VS shitty meatballs , cmon give us a cook off with these front bums #mkr"
4824," N'rage pink after ~ week, turquoise is a mix of special fx. Nrage pink holds very well. "
11194,"Bianca is ""feeling sick"". She tried the baked Greek eggs. #MKR"
1483, Free them to do what? Cut off the heads of gays? Honor killings? Child marriage? Exterminate Jews? Throw ppl off buildings?
8713,Double drool! Colin and Manu #MKR 
2196," I don't see any burning civilians, and the picture is not even of a burning house."
1677,Cut to Nikki breaking a yolk while separating eggs. #MKR
1901,I really want hotcakes and pancakes so bad! #MKR
11036, #MKR For the next lunch challenge Annie &amp
3554, When you accidentally open your front camera: 
3722,"C'mon Sheri and Emilie! You can do this, I can't see you in sudden death! #mkr "
166, We are suppose to believe that Muslims defended themselves all the way to Europe &amp
4446,Anyone for choc cake with White choc frosting #cake #chocolate #yum #mkr #masterchef #yum #getinmabelly 
4852,Cannot get over the fact that I got a sunburn in the middle of February. California is evil.
10758, I went with a different thought altogether but it didn't fit so I had to simplify. :) #MKR #MKR 
1289,Steve&gt
8449,"Kat and Andre are behaving in such a spiteful, vindictive manner. Who do they think they are - #MKR contestants?"
4004, time! THE TEXAN IS BACK BABY! #mykitchenrules #mkr
798, Tell me what your Quran : says?
10304,I wouldn't want to deconstruct my lemon tart #mkr 
7601,I would slap the smirk off Kat's face #MKR
11278," ""Lets create a nicer society by acting like absolute cunts to everyone"" - Social Justice Warrior Logic #GamerGate #WomenAgains..."
4386, I guess #Tammy is the next terrible summer comedy on the list. Only females will laugh in that theater. #Guaranteed #NotSe...
5959,". Well, I assume you saw my Clem Ford stuff. No MSM will write the truth about her. maybe? "
254, Reports out of Mosul are that a lot of Muslims are turning atheist as a result of the way ISIS is forcing the religion on them.
8068," Nope. Jessi and many other feminist's love our male tears, though... "
10290,"We've kinda got a system worked out. He sits his butt on my desk, front legs around my neck, and I try to type around his wagging tail."
851, Colin is obviously malnourished from their cooking cause he sounds delirious. #MKR
10964, I respect your use of Sprinkles Are For Winners.
1550,Oh well ... game over for today ... till next week ... have fun tweeps :D #mkr #mkr 
912, The Ezidis were out in the open with no shelter for month because of Daeshbags. So who cares.
10158,I love it when these judges compromise their values because the channel script writers tell them to. No credibility. #MKR
220,Watch the camera pan in on Cunt face #mkr
7060, At that point in time America thought that Islam was just a normal religion. Now we know that it is a piece of filthy imperialism.
2349, 
183," Well this is a pretty disgusting way to spin things, Gamergate. "
841," don't really know, most of those people are dumb."
1059, 
8809, Maybe you should learn intro stats b you lie ht...
8892, Wow!!! Good on you Ash and Camila! I feel like these guys are good humans who just take the mic now and then #MKR
1760, The difference between Christian and a Muslim. #Islam
1233, Who cares what ships are in the gulf.
9401,let's see what Ash and Camilla are up to. #mkr 
1294, Daesh have so many fronts to fight that they don't have the concentrated manpower to succeed any more.
6266, Notice we didn't see Kat and Andre in any of those cut aways? #mkr Yay!
630, Hamas was elected once and have not had elections since.They have skipped many elections. Mursi was going in same direction
1868, I cut out : in Arabic and stuck it into Google translate.
5891," The lesson the world learned about Islam is that when we get rid of their brutal dictators, they are replaced by brutal Islamists"
1388,I love this show #MKR
7415, weird.
3548, #ArnabGoswami is a woman. Just can't stop talking. #NotSexist
2295,Will be offering us a pension... Seems that this season of #MKR is never going to finish.. #MKR
8640, Utterly insane article.
99,the worst menu in #mkr history
11318," No, lying dumbass, she was older than him and already had her fortune when she met him and hired him."
1337,#mkr ahhh... the dulcet tones of Robert the Texan...
5481, And there have been dozens of witnesses who have seen the Russians target civilians for propaganda
5724, Armenian church of Mosul torched by Islamic State: 
9431,"If Katie &amp; Nikki go, I hope one of them give Kat a left hook on the way out. What a bitch. #mkr"
87, 
6004,"Why do dudes have to play the ""you're not serious, just wanting to fight"" card when women call them out on solutions with ill consequences?"
4023, something is changing in Mosul: Kurdistan flag raised over buildings by unknown protesters #ISIS #Iraq 
6165, Big shout out to for doing it right and doing right by trans people: 
2378," Kurt, are you--EFF--assuming I am guilty and taking that blog at face value?"
4269,I really want to fly kick Kat in the head #MKR
3971, Think she meant would men who shed obligations also lose rights..? Yes.
2183,. I saw/RT'ed it. Too funny. I saw this one today... 
1128,In what world are these two mingers models? #mkr
6687,RT Sum things jus aren't right coming from a girl'z lips... #NotSexist
8674,"Our journalists watch ISIS burn a man in a cage, and they respond with the same tired cliche about ""hijacking the religion"" BS! It's #Islam"
4757,"The Bureau of Justice Statistics report only analyzed REPORTED rapes, and since the VAST MAJORITY of rapes are UNREPORTED, cont"
1763,"So it would auto-unmute after N hours, or whatever."
2336," ""I Cheated On Helvetica With Comic Sans and I'm Not Sorry"" #TheNextNicheEroticaFad"
3820, there should b an app that tells you when the best time to walk into guitar center is without being raped by yr old's guit...
5261," Yes, unlike the gulf Muslim countries where they still behead and won't let women drive."
4155,RT Naah I'm not sexist but can someone get me this T-Shirt please? 
6078, #Kobane Eest Front #YPG forces bombarded violently #ISIS at several points About terrorists have killed in the same front ...
5852, 
6206," right!, listen to founding mother of #feminism #adviceforyoungfeminists / "
4297, RT The true history of #Islam and Slavery MUST SEE #PJNET
6555,Love a good generalization about a entire nation of people. #not #mkr
10697,"#MKR Kat and Andre don't like anything but yet Andres plate was clean funny that, fuck off already guys"
9095, I know that you will try.
10981,Running this account before a.m. without an Irish coffee is not recommended.
9035,ughhh ghazi why. 
9052, ....same time admiring the Ottoman state which was a total authoritarian slave state.
3920,The pink chick has a bad snaggletooth. Models don't #mkr
10532,I've been reassuring him and the family that it's okay - losing a dog would have been devastating to that family.
1830, the difficulty is finding time to find those allies while figuring out what to do with the ones I've got.
1116," lol. that guy. he tried to tell me that all companies should be small/indie. all tech companies, even."
10698," Then he launched a completely unprovoked attack on the Jews of Khybar, murdered many and stole their land."
1715, Muslim terrorist execute people daily. But when rare response happens to that provocation they fake being the victims
1282," All westerners didn't subscribe to Nazi ideology. All Muslims subscribe to the religion of hatered, murder, and bigotry"
1855, The violence is always initiated by the Muslims. Mohammed started it. Proof. 
4912,RT Can't believe they are releasing a female Thor comic book series. I'm not sexist but I really don't think it would work.
740, My Kitchen Rules #MKR #mkr They think they are better than anyone else in the group when they aren't 
3782, How does the US back the Shia militia. And why do assholes find a way to blame everything on the US?
5417, you can only have one GV # per acct at any given time.
626,why is their whole menu dick related?!?!?! #MKR
850," Oh, b/c see Emma, like many WW seem to think ""male gaze"" is only sexual. When their feminism CENTERS WM &amp; Whiteness over BW, ..."
719, come on Sheri and Emilie!!!! I have all the faith in the world girls!!! #MKR
2217, Am I watching punk'd ? #MKR
1214, Christians and Yezidis in Iraq thought their Muslim neighbors were fine until ISIS came along.....
7929,The Blonde cuties r yet serve! Oh dear &amp
2122,I cry foul! Boooooooo!!!!!!! #mkr
1554, Omg double elimination?! #MKR
10105," take that Kat &amp; Andre, scum of the earth LOL #mkr. I just can't with them... #mykitchenrules."
2120,Those poor #mkr contestants having to camp &amp
6417," They have been beheading Christians, Jews, Buddhist, Hindus, Ezidis, etc. for years. Their prophet did it from the start"
5446,Oh Shit. Now we have to put up with freaking Kat and No Balls Andre for another week. FMD. #mkr
